Running Multigrid for 150 300 150 with OMP_NUM_THREADS=32
Output directed to: /home/nhirt/AlgorithmEngineering_AltProject/run_tests/test_scaling (cwd=/home/nhirt/AlgorithmEngineering_AltProject/run_tests/test_scaling)
TOP3D_PRECOND=mg
Running GLOBAL topo-opt on cuboid: 150x300x150, V0=0.12, iters=50

==========================Displaying Inputs==========================
Simulation: 0
..............................................Volume Fraction: 0.1200
..........................................Filter Radius: 1.7321 Cells
................................................Cell Size: 1.0000e+00
.................................................#CG Iterations:  800
...........................................Youngs Modulus: 1.0000e+00
....................................Youngs Modulus (Min.): 1.0000e-06
...........................................Poissons Ratio: 3.0000e-01
Building Multigrid Hierarchy...
[MG] levels=3 coarsest=38x19x19 dofs=46800
Preparing Voxel-based FEA Model Costs        1.2s
Compliance of Fully Solid Domain:     2.596602e-01
 It.:    0 Solver Time:   95s.

 It.:   1 Obj.:  1.50179767e+02 Vol.:1.2000e-01 Sharp.:4.0534e-01 Cons.:-2.98e-08 Ch.:2.00e-01
 It.:    1 (Time)... Total per-It.: 9.50e+01s; CG: 9.45e+01s; Opti.: 5.18e-01s; Filtering: 3.18e-01s.
 It.:   2 Obj.:  2.68310011e+02 Vol.:1.2000e-01 Sharp.:4.0371e-01 Cons.:3.73e-08 Ch.:2.00e-01
 It.:    2 (Time)... Total per-It.: 9.45e+01s; CG: 9.41e+01s; Opti.: 4.79e-01s; Filtering: 2.87e-01s.
 It.:   3 Obj.:  4.04674871e+02 Vol.:1.2000e-01 Sharp.:3.8591e-01 Cons.:6.71e-08 Ch.:2.00e-01
 It.:    3 (Time)... Total per-It.: 9.46e+01s; CG: 9.41e+01s; Opti.: 4.80e-01s; Filtering: 2.89e-01s.
 It.:   4 Obj.:  5.73220072e+02 Vol.:1.2000e-01 Sharp.:3.6097e-01 Cons.:5.96e-08 Ch.:2.00e-01
 It.:    4 (Time)... Total per-It.: 9.46e+01s; CG: 9.41e+01s; Opti.: 4.99e-01s; Filtering: 3.07e-01s.
 It.:   5 Obj.:  7.85569315e+01 Vol.:1.2000e-01 Sharp.:3.6302e-01 Cons.:0.00e+00 Ch.:2.00e-01
 It.:    5 (Time)... Total per-It.: 9.42e+01s; CG: 9.37e+01s; Opti.: 5.10e-01s; Filtering: 3.09e-01s.
 It.:   6 Obj.:  2.57929518e+02 Vol.:1.2000e-01 Sharp.:3.5364e-01 Cons.:2.24e-08 Ch.:2.00e-01
 It.:    6 (Time)... Total per-It.: 9.38e+01s; CG: 9.33e+01s; Opti.: 5.07e-01s; Filtering: 3.17e-01s.
 It.:   7 Obj.:  9.41949135e+02 Vol.:1.2000e-01 Sharp.:3.2216e-01 Cons.:6.71e-08 Ch.:2.00e-01
 It.:    7 (Time)... Total per-It.: 9.37e+01s; CG: 9.32e+01s; Opti.: 4.94e-01s; Filtering: 3.10e-01s.
 It.:   8 Obj.:  2.04197423e+03 Vol.:1.2000e-01 Sharp.:2.7137e-01 Cons.:2.98e-08 Ch.:2.00e-01
 It.:    8 (Time)... Total per-It.: 9.37e+01s; CG: 9.32e+01s; Opti.: 5.25e-01s; Filtering: 3.37e-01s.
 It.:   9 Obj.:  3.80436007e+03 Vol.:1.2000e-01 Sharp.:2.1480e-01 Cons.:4.47e-08 Ch.:2.00e-01
 It.:    9 (Time)... Total per-It.: 9.37e+01s; CG: 9.32e+01s; Opti.: 4.90e-01s; Filtering: 3.10e-01s.
 It.:  10 Obj.:  4.27997100e+04 Vol.:1.2000e-01 Sharp.:2.4666e-01 Cons.:-1.49e-08 Ch.:2.00e-01
 It.:   10 (Time)... Total per-It.: 9.21e+01s; CG: 9.15e+01s; Opti.: 5.44e-01s; Filtering: 3.55e-01s.
 It.:  11 Obj.:  1.07673639e+05 Vol.:1.2000e-01 Sharp.:3.0839e-01 Cons.:-1.49e-08 Ch.:2.00e-01
 It.:   11 (Time)... Total per-It.: 9.33e+01s; CG: 9.27e+01s; Opti.: 5.89e-01s; Filtering: 4.06e-01s.
 It.:  12 Obj.:  4.89598463e+07 Vol.:1.2000e-01 Sharp.:3.2128e-01 Cons.:-7.45e-09 Ch.:2.00e-01
 It.:   12 (Time)... Total per-It.: 9.34e+01s; CG: 9.27e+01s; Opti.: 6.73e-01s; Filtering: 5.19e-01s.
 It.:  13 Obj.:  3.67756370e+08 Vol.:1.2000e-01 Sharp.:2.8284e-01 Cons.:-2.98e-08 Ch.:2.00e-01
 It.:   13 (Time)... Total per-It.: 9.37e+01s; CG: 9.30e+01s; Opti.: 6.93e-01s; Filtering: 5.49e-01s.
 It.:  14 Obj.:  6.99917089e+08 Vol.:1.2000e-01 Sharp.:2.2908e-01 Cons.:-1.49e-08 Ch.:2.00e-01
 It.:   14 (Time)... Total per-It.: 9.35e+01s; CG: 9.28e+01s; Opti.: 7.10e-01s; Filtering: 5.67e-01s.
 It.:  15 Obj.:  1.35613112e+06 Vol.:1.2000e-01 Sharp.:2.3939e-01 Cons.:-2.98e-08 Ch.:2.00e-01
 It.:   15 (Time)... Total per-It.: 9.22e+01s; CG: 9.15e+01s; Opti.: 7.02e-01s; Filtering: 5.38e-01s.
 It.:  16 Obj.:  4.03215092e+06 Vol.:1.2000e-01 Sharp.:2.3002e-01 Cons.:2.24e-08 Ch.:2.00e-01
 It.:   16 (Time)... Total per-It.: 9.12e+01s; CG: 9.06e+01s; Opti.: 6.23e-01s; Filtering: 4.64e-01s.
 It.:  17 Obj.:  1.13572252e+07 Vol.:1.2000e-01 Sharp.:1.9285e-01 Cons.:0.00e+00 Ch.:2.00e-01
 It.:   17 (Time)... Total per-It.: 9.36e+01s; CG: 9.29e+01s; Opti.: 6.53e-01s; Filtering: 4.94e-01s.
 It.:  18 Obj.:  2.77912157e+07 Vol.:1.2000e-01 Sharp.:1.3891e-01 Cons.:2.24e-08 Ch.:2.00e-01
 It.:   18 (Time)... Total per-It.: 9.40e+01s; CG: 9.33e+01s; Opti.: 6.61e-01s; Filtering: 5.06e-01s.
 It.:  19 Obj.:  5.49590083e+07 Vol.:1.2000e-01 Sharp.:9.4489e-02 Cons.:0.00e+00 Ch.:2.00e-01
 It.:   19 (Time)... Total per-It.: 9.37e+01s; CG: 9.31e+01s; Opti.: 6.26e-01s; Filtering: 4.73e-01s.
 It.:  20 Obj.:  1.51862718e+05 Vol.:1.2000e-01 Sharp.:1.0971e-01 Cons.:2.24e-08 Ch.:2.00e-01
 It.:   20 (Time)... Total per-It.: 9.24e+01s; CG: 9.17e+01s; Opti.: 7.08e-01s; Filtering: 5.37e-01s.
 It.:  21 Obj.:  5.38370298e+05 Vol.:1.2000e-01 Sharp.:1.1994e-01 Cons.:2.98e-08 Ch.:2.00e-01
 It.:   21 (Time)... Total per-It.: 9.39e+01s; CG: 9.32e+01s; Opti.: 6.41e-01s; Filtering: 4.62e-01s.
 It.:  22 Obj.:  2.05797776e+06 Vol.:1.2000e-01 Sharp.:1.2380e-01 Cons.:2.24e-08 Ch.:2.00e-01
 It.:   22 (Time)... Total per-It.: 9.35e+01s; CG: 9.28e+01s; Opti.: 6.61e-01s; Filtering: 4.93e-01s.
 It.:  23 Obj.:  6.14793555e+06 Vol.:1.2000e-01 Sharp.:1.1677e-01 Cons.:2.24e-08 Ch.:2.00e-01
 It.:   23 (Time)... Total per-It.: 9.36e+01s; CG: 9.29e+01s; Opti.: 6.57e-01s; Filtering: 4.89e-01s.
 It.:  24 Obj.:  1.45633558e+07 Vol.:1.2000e-01 Sharp.:1.0303e-01 Cons.:0.00e+00 Ch.:2.00e-01
 It.:   24 (Time)... Total per-It.: 9.38e+01s; CG: 9.31e+01s; Opti.: 6.85e-01s; Filtering: 5.22e-01s.
 It.:  25 Obj.:  1.14415380e+05 Vol.:1.2000e-01 Sharp.:1.0669e-01 Cons.:0.00e+00 Ch.:2.00e-01
 It.:   25 (Time)... Total per-It.: 9.00e+01s; CG: 8.93e+01s; Opti.: 6.83e-01s; Filtering: 5.18e-01s.
 It.:  26 Obj.:  1.40351738e+06 Vol.:1.2000e-01 Sharp.:1.0454e-01 Cons.:0.00e+00 Ch.:2.00e-01
 It.:   26 (Time)... Total per-It.: 9.35e+01s; CG: 9.28e+01s; Opti.: 6.62e-01s; Filtering: 4.93e-01s.
 It.:  27 Obj.:  7.78874611e+06 Vol.:1.2000e-01 Sharp.:1.0277e-01 Cons.:7.45e-09 Ch.:2.00e-01
 It.:   27 (Time)... Total per-It.: 9.37e+01s; CG: 9.30e+01s; Opti.: 6.68e-01s; Filtering: 5.00e-01s.
 It.:  28 Obj.:  2.47154116e+07 Vol.:1.2000e-01 Sharp.:1.0379e-01 Cons.:2.98e-08 Ch.:2.00e-01
 It.:   28 (Time)... Total per-It.: 9.35e+01s; CG: 9.28e+01s; Opti.: 6.79e-01s; Filtering: 5.15e-01s.
 It.:  29 Obj.:  6.03515851e+07 Vol.:1.2000e-01 Sharp.:1.0448e-01 Cons.:2.24e-08 Ch.:2.00e-01
 It.:   29 (Time)... Total per-It.: 9.40e+01s; CG: 9.33e+01s; Opti.: 7.17e-01s; Filtering: 5.55e-01s.
 It.:  30 Obj.:  9.52902209e+05 Vol.:1.2000e-01 Sharp.:1.1147e-01 Cons.:2.24e-08 Ch.:2.00e-01
 It.:   30 (Time)... Total per-It.: 8.99e+01s; CG: 8.92e+01s; Opti.: 7.13e-01s; Filtering: 5.47e-01s.
 It.:  31 Obj.:  1.69300759e+06 Vol.:1.2000e-01 Sharp.:1.0743e-01 Cons.:7.45e-09 Ch.:2.00e-01
 It.:   31 (Time)... Total per-It.: 9.29e+01s; CG: 9.22e+01s; Opti.: 6.39e-01s; Filtering: 4.75e-01s.
 It.:  32 Obj.:  3.13503748e+06 Vol.:1.2000e-01 Sharp.:9.7072e-02 Cons.:-7.45e-09 Ch.:2.00e-01
 It.:   32 (Time)... Total per-It.: 9.38e+01s; CG: 9.31e+01s; Opti.: 6.09e-01s; Filtering: 4.45e-01s.
 It.:  33 Obj.:  5.81012864e+06 Vol.:1.2000e-01 Sharp.:8.1808e-02 Cons.:0.00e+00 Ch.:2.00e-01
 It.:   33 (Time)... Total per-It.: 9.34e+01s; CG: 9.28e+01s; Opti.: 6.46e-01s; Filtering: 4.84e-01s.
 It.:  34 Obj.:  1.05697485e+07 Vol.:1.2000e-01 Sharp.:6.5503e-02 Cons.:7.45e-09 Ch.:2.00e-01
 It.:   34 (Time)... Total per-It.: 9.39e+01s; CG: 9.32e+01s; Opti.: 6.57e-01s; Filtering: 4.91e-01s.
 It.:  35 Obj.:  4.11658151e+05 Vol.:1.2000e-01 Sharp.:7.9284e-02 Cons.:-7.45e-09 Ch.:2.00e-01
 It.:   35 (Time)... Total per-It.: 8.95e+01s; CG: 8.89e+01s; Opti.: 6.36e-01s; Filtering: 4.75e-01s.
 It.:  36 Obj.:  8.80260101e+06 Vol.:1.2000e-01 Sharp.:9.3051e-02 Cons.:-7.45e-09 Ch.:2.00e-01
 It.:   36 (Time)... Total per-It.: 9.08e+01s; CG: 9.01e+01s; Opti.: 7.12e-01s; Filtering: 5.45e-01s.
 It.:  37 Obj.:  6.33372939e+07 Vol.:1.2000e-01 Sharp.:1.0312e-01 Cons.:0.00e+00 Ch.:2.00e-01
 It.:   37 (Time)... Total per-It.: 9.38e+01s; CG: 9.31e+01s; Opti.: 7.22e-01s; Filtering: 5.53e-01s.
 It.:  38 Obj.:  1.85851203e+08 Vol.:1.2000e-01 Sharp.:1.0469e-01 Cons.:0.00e+00 Ch.:2.00e-01
 It.:   38 (Time)... Total per-It.: 9.34e+01s; CG: 9.27e+01s; Opti.: 7.29e-01s; Filtering: 5.70e-01s.
 It.:  39 Obj.:  4.20032774e+08 Vol.:1.2000e-01 Sharp.:9.6243e-02 Cons.:7.45e-09 Ch.:2.00e-01
 It.:   39 (Time)... Total per-It.: 9.36e+01s; CG: 9.28e+01s; Opti.: 7.47e-01s; Filtering: 5.83e-01s.
 It.:  40 Obj.:  2.65638285e+05 Vol.:1.2000e-01 Sharp.:1.0913e-01 Cons.:-1.49e-08 Ch.:2.00e-01
 It.:   40 (Time)... Total per-It.: 9.01e+01s; CG: 8.95e+01s; Opti.: 5.72e-01s; Filtering: 4.01e-01s.
 It.:  41 Obj.:  2.29141854e+06 Vol.:1.2000e-01 Sharp.:1.1511e-01 Cons.:-1.49e-08 Ch.:2.00e-01
 It.:   41 (Time)... Total per-It.: 8.93e+01s; CG: 8.86e+01s; Opti.: 6.62e-01s; Filtering: 4.90e-01s.
 It.:  42 Obj.:  2.15102491e+07 Vol.:1.2000e-01 Sharp.:1.1221e-01 Cons.:0.00e+00 Ch.:2.00e-01
 It.:   42 (Time)... Total per-It.: 9.37e+01s; CG: 9.31e+01s; Opti.: 6.90e-01s; Filtering: 5.27e-01s.
 It.:  43 Obj.:  1.00915863e+08 Vol.:1.2000e-01 Sharp.:1.0135e-01 Cons.:2.24e-08 Ch.:2.00e-01
 It.:   43 (Time)... Total per-It.: 9.37e+01s; CG: 9.30e+01s; Opti.: 7.02e-01s; Filtering: 5.33e-01s.
 It.:  44 Obj.:  3.11042704e+08 Vol.:1.2000e-01 Sharp.:8.7437e-02 Cons.:2.24e-08 Ch.:2.00e-01
 It.:   44 (Time)... Total per-It.: 9.37e+01s; CG: 9.29e+01s; Opti.: 7.09e-01s; Filtering: 5.45e-01s.
 It.:  45 Obj.:  1.56274625e+07 Vol.:1.2000e-01 Sharp.:9.2531e-02 Cons.:2.24e-08 Ch.:2.00e-01
 It.:   45 (Time)... Total per-It.: 9.03e+01s; CG: 8.96e+01s; Opti.: 7.54e-01s; Filtering: 5.96e-01s.
 It.:  46 Obj.:  2.83212612e+07 Vol.:1.2000e-01 Sharp.:9.1905e-02 Cons.:0.00e+00 Ch.:2.00e-01
 It.:   46 (Time)... Total per-It.: 8.94e+01s; CG: 8.87e+01s; Opti.: 6.60e-01s; Filtering: 5.13e-01s.
 It.:  47 Obj.:  5.13140466e+07 Vol.:1.2000e-01 Sharp.:8.6217e-02 Cons.:0.00e+00 Ch.:2.00e-01
 It.:   47 (Time)... Total per-It.: 9.07e+01s; CG: 9.00e+01s; Opti.: 6.57e-01s; Filtering: 5.10e-01s.
 It.:  48 Obj.:  8.87799638e+07 Vol.:1.2000e-01 Sharp.:7.5727e-02 Cons.:0.00e+00 Ch.:2.00e-01
 It.:   48 (Time)... Total per-It.: 9.15e+01s; CG: 9.08e+01s; Opti.: 7.02e-01s; Filtering: 5.49e-01s.
 It.:  49 Obj.:  1.43616552e+08 Vol.:1.2000e-01 Sharp.:6.3794e-02 Cons.:0.00e+00 Ch.:2.00e-01
 It.:   49 (Time)... Total per-It.: 9.11e+01s; CG: 9.04e+01s; Opti.: 7.02e-01s; Filtering: 5.50e-01s.
 It.:  50 Obj.:  1.24195732e+07 Vol.:1.2000e-01 Sharp.:7.3378e-02 Cons.:0.00e+00 Ch.:2.00e-01
 It.:   50 (Time)... Total per-It.: 9.01e+01s; CG: 8.94e+01s; Opti.: 7.12e-01s; Filtering: 5.59e-01s.

..........Performing Topology Optimization Costs (in total): 4.7356e+03s.

PARAMETERS
original dims: x=300, y=150, z=150
padded dims: x=304, y=152, z=152
v0: 0.12

SOLVING
iterations: 50
cg iterations: 800

RESULTS
compliance solid: 2.596602e-01
objective first: 1.501798e+02
objective last: 1.241957e+07

TIME
total solver time: 4.606618e+03
time per iter: 92.7827
percentage time spent on cg: 99.30%
percentage time spent on optim: 0.69%
percentage time spent on filtering: 0.51%

THREADS
32

NOTES

STL file saved to: /orcd/home/002/nhirt/AlgorithmEngineering_AltProject/run_tests/test_scaling/out/stl/GLOBAL_20251208_224311_7043589.stl

Done.

............Total runtime time for 1 simulations4.7359e+03s.
