Running Multigrid for 128 256 128 with OMP_NUM_THREADS=32
Output directed to: /home/nhirt/AlgorithmEngineering_AltProject/run_tests/test_scaling (cwd=/home/nhirt/AlgorithmEngineering_AltProject/run_tests/test_scaling)
TOP3D_PRECOND=mg
Running GLOBAL topo-opt on cuboid: 128x256x128, V0=0.12, iters=50

==========================Displaying Inputs==========================
Simulation: 0
..............................................Volume Fraction: 0.1200
..........................................Filter Radius: 1.7321 Cells
................................................Cell Size: 1.0000e+00
.................................................#CG Iterations:  800
...........................................Youngs Modulus: 1.0000e+00
....................................Youngs Modulus (Min.): 1.0000e-06
...........................................Poissons Ratio: 3.0000e-01
Building Multigrid Hierarchy...
[MG] levels=5 coarsest=8x4x4 dofs=675
Preparing Voxel-based FEA Model Costs        1.1s
Compliance of Fully Solid Domain:     4.206113e-01
 It.:    0 Solver Time:   60s.

 It.:   1 Obj.:  2.49901705e+02 Vol.:1.2000e-01 Sharp.:4.0569e-01 Cons.:-3.73e-08 Ch.:2.00e-01
 It.:    1 (Time)... Total per-It.: 5.98e+01s; CG: 5.95e+01s; Opti.: 3.79e-01s; Filtering: 2.35e-01s.
 It.:   2 Obj.:  1.24310536e+02 Vol.:1.2000e-01 Sharp.:4.0116e-01 Cons.:-6.71e-08 Ch.:2.00e-01
 It.:    2 (Time)... Total per-It.: 6.00e+01s; CG: 5.96e+01s; Opti.: 3.25e-01s; Filtering: 1.85e-01s.
 It.:   3 Obj.:  5.92091720e+01 Vol.:1.2000e-01 Sharp.:3.6844e-01 Cons.:-5.96e-08 Ch.:2.00e-01
 It.:    3 (Time)... Total per-It.: 5.93e+01s; CG: 5.90e+01s; Opti.: 3.08e-01s; Filtering: 1.75e-01s.
 It.:   4 Obj.:  3.56405838e+01 Vol.:1.2000e-01 Sharp.:3.6792e-01 Cons.:5.22e-08 Ch.:2.00e-01
 It.:    4 (Time)... Total per-It.: 5.98e+01s; CG: 5.95e+01s; Opti.: 2.94e-01s; Filtering: 1.54e-01s.
 It.:   5 Obj.:  5.56273549e+01 Vol.:1.2000e-01 Sharp.:3.5729e-01 Cons.:0.00e+00 Ch.:2.00e-01
 It.:    5 (Time)... Total per-It.: 6.42e+01s; CG: 6.39e+01s; Opti.: 3.20e-01s; Filtering: 1.78e-01s.
 It.:   6 Obj.:  1.54030678e+02 Vol.:1.2000e-01 Sharp.:3.3539e-01 Cons.:0.00e+00 Ch.:2.00e-01
 It.:    6 (Time)... Total per-It.: 6.20e+01s; CG: 6.16e+01s; Opti.: 3.39e-01s; Filtering: 2.07e-01s.
 It.:   7 Obj.:  2.86521676e+02 Vol.:1.2000e-01 Sharp.:3.0357e-01 Cons.:2.24e-08 Ch.:2.00e-01
 It.:    7 (Time)... Total per-It.: 5.99e+01s; CG: 5.96e+01s; Opti.: 3.12e-01s; Filtering: 1.75e-01s.
 It.:   8 Obj.:  4.41419814e+02 Vol.:1.2000e-01 Sharp.:2.5693e-01 Cons.:5.96e-08 Ch.:2.00e-01
 It.:    8 (Time)... Total per-It.: 5.93e+01s; CG: 5.90e+01s; Opti.: 3.09e-01s; Filtering: 1.86e-01s.
 It.:   9 Obj.:  6.97705566e+02 Vol.:1.2000e-01 Sharp.:2.0363e-01 Cons.:2.24e-08 Ch.:2.00e-01
 It.:    9 (Time)... Total per-It.: 5.90e+01s; CG: 5.87e+01s; Opti.: 3.13e-01s; Filtering: 1.88e-01s.
 It.:  10 Obj.:  8.78628691e+02 Vol.:1.2000e-01 Sharp.:2.0393e-01 Cons.:2.24e-08 Ch.:2.00e-01
 It.:   10 (Time)... Total per-It.: 6.38e+01s; CG: 6.34e+01s; Opti.: 3.75e-01s; Filtering: 2.37e-01s.
 It.:  11 Obj.:  3.70038932e+04 Vol.:1.2000e-01 Sharp.:1.9917e-01 Cons.:-1.49e-08 Ch.:2.00e-01
 It.:   11 (Time)... Total per-It.: 6.24e+01s; CG: 6.20e+01s; Opti.: 3.61e-01s; Filtering: 2.42e-01s.
 It.:  12 Obj.:  2.76954823e+05 Vol.:1.2000e-01 Sharp.:1.8350e-01 Cons.:-2.24e-08 Ch.:2.00e-01
 It.:   12 (Time)... Total per-It.: 5.90e+01s; CG: 5.86e+01s; Opti.: 3.96e-01s; Filtering: 2.73e-01s.
 It.:  13 Obj.:  9.19545780e+05 Vol.:1.2000e-01 Sharp.:1.6505e-01 Cons.:7.45e-09 Ch.:2.00e-01
 It.:   13 (Time)... Total per-It.: 5.96e+01s; CG: 5.92e+01s; Opti.: 4.34e-01s; Filtering: 2.97e-01s.
 It.:  14 Obj.:  2.30958423e+06 Vol.:1.2000e-01 Sharp.:1.2705e-01 Cons.:7.45e-09 Ch.:2.00e-01
 It.:   14 (Time)... Total per-It.: 5.92e+01s; CG: 5.88e+01s; Opti.: 4.13e-01s; Filtering: 2.99e-01s.
 It.:  15 Obj.:  5.11192574e+03 Vol.:1.2000e-01 Sharp.:1.1909e-01 Cons.:-2.24e-08 Ch.:2.00e-01
 It.:   15 (Time)... Total per-It.: 6.35e+01s; CG: 6.30e+01s; Opti.: 4.25e-01s; Filtering: 2.94e-01s.
 It.:  16 Obj.:  1.31920971e+04 Vol.:1.2000e-01 Sharp.:1.3938e-01 Cons.:-7.45e-09 Ch.:2.00e-01
 It.:   16 (Time)... Total per-It.: 6.23e+01s; CG: 6.19e+01s; Opti.: 3.63e-01s; Filtering: 2.35e-01s.
 It.:  17 Obj.:  4.72230810e+04 Vol.:1.2000e-01 Sharp.:1.4670e-01 Cons.:-7.45e-09 Ch.:2.00e-01
 It.:   17 (Time)... Total per-It.: 6.29e+01s; CG: 6.25e+01s; Opti.: 4.05e-01s; Filtering: 2.72e-01s.
 It.:  18 Obj.:  1.30146788e+05 Vol.:1.2000e-01 Sharp.:1.3711e-01 Cons.:0.00e+00 Ch.:2.00e-01
 It.:   18 (Time)... Total per-It.: 5.94e+01s; CG: 5.90e+01s; Opti.: 3.77e-01s; Filtering: 2.59e-01s.
 It.:  19 Obj.:  2.88674085e+05 Vol.:1.2000e-01 Sharp.:1.1762e-01 Cons.:7.45e-09 Ch.:2.00e-01
 It.:   19 (Time)... Total per-It.: 5.95e+01s; CG: 5.91e+01s; Opti.: 3.78e-01s; Filtering: 2.59e-01s.
 It.:  20 Obj.:  4.70705005e+03 Vol.:1.2000e-01 Sharp.:1.3142e-01 Cons.:0.00e+00 Ch.:2.00e-01
 It.:   20 (Time)... Total per-It.: 6.26e+01s; CG: 6.22e+01s; Opti.: 4.12e-01s; Filtering: 2.89e-01s.
 It.:  21 Obj.:  1.92807855e+04 Vol.:1.2000e-01 Sharp.:1.3845e-01 Cons.:-7.45e-09 Ch.:2.00e-01
 It.:   21 (Time)... Total per-It.: 5.97e+01s; CG: 5.93e+01s; Opti.: 3.86e-01s; Filtering: 2.52e-01s.
 It.:  22 Obj.:  8.06867983e+04 Vol.:1.2000e-01 Sharp.:1.3062e-01 Cons.:1.49e-08 Ch.:2.00e-01
 It.:   22 (Time)... Total per-It.: 5.84e+01s; CG: 5.80e+01s; Opti.: 4.18e-01s; Filtering: 3.02e-01s.
 It.:  23 Obj.:  2.23612117e+05 Vol.:1.2000e-01 Sharp.:1.0805e-01 Cons.:1.49e-08 Ch.:2.00e-01
 It.:   23 (Time)... Total per-It.: 5.90e+01s; CG: 5.87e+01s; Opti.: 3.80e-01s; Filtering: 2.75e-01s.
 It.:  24 Obj.:  4.66722180e+05 Vol.:1.2000e-01 Sharp.:8.5013e-02 Cons.:7.45e-09 Ch.:2.00e-01
 It.:   24 (Time)... Total per-It.: 5.77e+01s; CG: 5.74e+01s; Opti.: 3.61e-01s; Filtering: 2.53e-01s.
 It.:  25 Obj.:  2.46741522e+03 Vol.:1.2000e-01 Sharp.:9.9470e-02 Cons.:-7.45e-09 Ch.:2.00e-01
 It.:   25 (Time)... Total per-It.: 6.15e+01s; CG: 6.11e+01s; Opti.: 4.07e-01s; Filtering: 2.83e-01s.
 It.:  26 Obj.:  6.13584047e+03 Vol.:1.2000e-01 Sharp.:1.0871e-01 Cons.:2.24e-08 Ch.:2.00e-01
 It.:   26 (Time)... Total per-It.: 6.12e+01s; CG: 6.08e+01s; Opti.: 3.97e-01s; Filtering: 2.73e-01s.
 It.:  27 Obj.:  1.87043562e+04 Vol.:1.2000e-01 Sharp.:1.1183e-01 Cons.:-1.49e-08 Ch.:2.00e-01
 It.:   27 (Time)... Total per-It.: 6.18e+01s; CG: 6.14e+01s; Opti.: 3.65e-01s; Filtering: 2.52e-01s.
 It.:  28 Obj.:  4.59403049e+04 Vol.:1.2000e-01 Sharp.:1.0610e-01 Cons.:-7.45e-09 Ch.:2.00e-01
 It.:   28 (Time)... Total per-It.: 6.07e+01s; CG: 6.03e+01s; Opti.: 3.55e-01s; Filtering: 2.44e-01s.
 It.:  29 Obj.:  9.03655756e+04 Vol.:1.2000e-01 Sharp.:9.2481e-02 Cons.:0.00e+00 Ch.:2.00e-01
 It.:   29 (Time)... Total per-It.: 5.98e+01s; CG: 5.94e+01s; Opti.: 3.90e-01s; Filtering: 2.67e-01s.
 It.:  30 Obj.:  1.38197302e+05 Vol.:1.2000e-01 Sharp.:9.1350e-02 Cons.:0.00e+00 Ch.:2.00e-01
 It.:   30 (Time)... Total per-It.: 6.12e+01s; CG: 6.08e+01s; Opti.: 3.67e-01s; Filtering: 2.55e-01s.
 It.:  31 Obj.:  8.92287259e+04 Vol.:1.2000e-01 Sharp.:8.9011e-02 Cons.:-7.45e-09 Ch.:2.00e-01
 It.:   31 (Time)... Total per-It.: 6.07e+01s; CG: 6.03e+01s; Opti.: 3.71e-01s; Filtering: 2.58e-01s.
 It.:  32 Obj.:  9.57986478e+04 Vol.:1.2000e-01 Sharp.:7.9332e-02 Cons.:0.00e+00 Ch.:2.00e-01
 It.:   32 (Time)... Total per-It.: 6.16e+01s; CG: 6.12e+01s; Opti.: 3.70e-01s; Filtering: 2.63e-01s.
 It.:  33 Obj.:  1.11387084e+05 Vol.:1.2000e-01 Sharp.:6.6558e-02 Cons.:1.49e-08 Ch.:2.00e-01
 It.:   33 (Time)... Total per-It.: 6.07e+01s; CG: 6.04e+01s; Opti.: 3.46e-01s; Filtering: 2.28e-01s.
 It.:  34 Obj.:  1.29588658e+05 Vol.:1.2000e-01 Sharp.:5.3095e-02 Cons.:-7.45e-09 Ch.:2.00e-01
 It.:   34 (Time)... Total per-It.: 6.07e+01s; CG: 6.03e+01s; Opti.: 3.54e-01s; Filtering: 2.39e-01s.
 It.:  35 Obj.:  1.31164165e+05 Vol.:1.2000e-01 Sharp.:4.7111e-02 Cons.:0.00e+00 Ch.:2.00e-01
 It.:   35 (Time)... Total per-It.: 6.12e+01s; CG: 6.08e+01s; Opti.: 3.71e-01s; Filtering: 2.60e-01s.
 It.:  36 Obj.:  1.30341472e+05 Vol.:1.2000e-01 Sharp.:4.7778e-02 Cons.:0.00e+00 Ch.:2.00e-01
 It.:   36 (Time)... Total per-It.: 6.16e+01s; CG: 6.12e+01s; Opti.: 3.72e-01s; Filtering: 2.63e-01s.
 It.:  37 Obj.:  1.25276263e+05 Vol.:1.2000e-01 Sharp.:4.8144e-02 Cons.:7.45e-09 Ch.:2.00e-01
 It.:   37 (Time)... Total per-It.: 6.10e+01s; CG: 6.06e+01s; Opti.: 3.52e-01s; Filtering: 2.39e-01s.
 It.:  38 Obj.:  1.28548671e+05 Vol.:1.2000e-01 Sharp.:4.7036e-02 Cons.:-7.45e-09 Ch.:2.00e-01
 It.:   38 (Time)... Total per-It.: 6.10e+01s; CG: 6.06e+01s; Opti.: 3.71e-01s; Filtering: 2.58e-01s.
 It.:  39 Obj.:  1.34214117e+05 Vol.:1.2000e-01 Sharp.:4.5867e-02 Cons.:0.00e+00 Ch.:2.00e-01
 It.:   39 (Time)... Total per-It.: 6.05e+01s; CG: 6.01e+01s; Opti.: 3.74e-01s; Filtering: 2.62e-01s.
 It.:  40 Obj.:  5.58776993e+05 Vol.:1.2000e-01 Sharp.:4.9201e-02 Cons.:-7.45e-09 Ch.:2.00e-01
 It.:   40 (Time)... Total per-It.: 6.15e+01s; CG: 6.11e+01s; Opti.: 4.07e-01s; Filtering: 3.03e-01s.
 It.:  41 Obj.:  8.26887833e+05 Vol.:1.2000e-01 Sharp.:5.4655e-02 Cons.:2.24e-08 Ch.:2.00e-01
 It.:   41 (Time)... Total per-It.: 6.09e+01s; CG: 6.04e+01s; Opti.: 4.54e-01s; Filtering: 3.43e-01s.
 It.:  42 Obj.:  7.41207176e+05 Vol.:1.2000e-01 Sharp.:6.0253e-02 Cons.:1.49e-08 Ch.:2.00e-01
 It.:   42 (Time)... Total per-It.: 6.18e+01s; CG: 6.14e+01s; Opti.: 3.90e-01s; Filtering: 2.89e-01s.
 It.:  43 Obj.:  8.50296145e+05 Vol.:1.2000e-01 Sharp.:5.9873e-02 Cons.:1.49e-08 Ch.:2.00e-01
 It.:   43 (Time)... Total per-It.: 6.17e+01s; CG: 6.13e+01s; Opti.: 3.91e-01s; Filtering: 2.82e-01s.
 It.:  44 Obj.:  7.37691827e+05 Vol.:1.2000e-01 Sharp.:5.5775e-02 Cons.:0.00e+00 Ch.:2.00e-01
 It.:   44 (Time)... Total per-It.: 6.10e+01s; CG: 6.06e+01s; Opti.: 3.84e-01s; Filtering: 2.79e-01s.
 It.:  45 Obj.:            -nan Vol.:8.8857e-02 Sharp.:9.5862e-02 Cons.:-3.11e-02 Ch.:2.00e-01
 It.:   45 (Time)... Total per-It.: 6.33e+01s; CG: 6.15e+01s; Opti.: 1.77e+00s; Filtering: 1.49e+00s.
 It.:  46 Obj.:            -nan Vol.:6.2850e-02 Sharp.:1.1137e-01 Cons.:-5.72e-02 Ch.:2.00e-01
 It.:   46 (Time)... Total per-It.: 6.25e+01s; CG: 6.07e+01s; Opti.: 1.79e+00s; Filtering: 1.53e+00s.
 It.:  47 Obj.:            -nan Vol.:3.9769e-02 Sharp.:9.9465e-02 Cons.:-8.02e-02 Ch.:2.00e-01
 It.:   47 (Time)... Total per-It.: 6.29e+01s; CG: 6.11e+01s; Opti.: 1.79e+00s; Filtering: 1.53e+00s.
 It.:  48 Obj.:            -nan Vol.:1.9086e-02 Sharp.:6.2118e-02 Cons.:-1.01e-01 Ch.:2.00e-01
 It.:   48 (Time)... Total per-It.: 6.35e+01s; CG: 6.19e+01s; Opti.: 1.68e+00s; Filtering: 1.42e+00s.
 It.:  49 Obj.:            -nan Vol.:9.9971e-04 Sharp.:3.9970e-03 Cons.:-1.19e-01 Ch.:1.99e-01
 It.:   49 (Time)... Total per-It.: 6.34e+01s; CG: 6.16e+01s; Opti.: 1.76e+00s; Filtering: 1.48e+00s.

..........Performing Topology Optimization Costs (in total): 3.0514e+03s.

PARAMETERS
original dims: x=256, y=128, z=128
padded dims: x=256, y=128, z=128
v0: 0.12

SOLVING
iterations: 49
cg iterations: 800

RESULTS
compliance solid: 4.206113e-01
objective first: 2.499017e+02
objective last: -nan

TIME
total solver time: 2.964639e+03
time per iter: 61.0222
percentage time spent on cg: 99.15%
percentage time spent on optim: 0.84%
percentage time spent on filtering: 0.62%

THREADS
32

NOTES

STL file saved to: /orcd/home/002/nhirt/AlgorithmEngineering_AltProject/run_tests/test_scaling/out/stl/GLOBAL_20251208_214551_7043585.stl

Done.

............Total runtime time for 1 simulations3.0517e+03s.
