Running Multigrid for 32 64 32 with OMP_NUM_THREADS=32
Output directed to: /home/nhirt/AlgorithmEngineering_AltProject/run_tests/test_scaling (cwd=/home/nhirt/AlgorithmEngineering_AltProject/run_tests/test_scaling)
Running GLOBAL topo-opt on cuboid: 32x64x32, V0=0.12, iters=50

==========================Displaying Inputs==========================
Simulation: 0
..............................................Volume Fraction: 0.1200
..........................................Filter Radius: 1.7321 Cells
................................................Cell Size: 1.0000e+00
.................................................#CG Iterations:  800
...........................................Youngs Modulus: 1.0000e+00
....................................Youngs Modulus (Min.): 1.0000e-06
...........................................Poissons Ratio: 3.0000e-01
Building Multigrid Hierarchy...
[MG] levels=4 coarsest=4x2x2 dofs=135
Preparing Voxel-based FEA Model Costs        0.0s
Compliance of Fully Solid Domain:     1.251475e+00
 It.:    0 Solver Time:    2s.

 It.:   1 Obj.:  7.21561224e+02 Vol.:1.2000e-01 Sharp.:4.0611e-01 Cons.:-2.24e-08 Ch.:2.00e-01
 It.:    1 (Time)... Total per-It.: 1.66e+00s; CG: 1.65e+00s; Opti.: 8.49e-03s; Filtering: 6.61e-03s.
 It.:   2 Obj.:  4.31035050e+02 Vol.:1.2000e-01 Sharp.:4.0467e-01 Cons.:-3.73e-08 Ch.:1.97e-01
 It.:    2 (Time)... Total per-It.: 1.64e+00s; CG: 1.63e+00s; Opti.: 4.25e-03s; Filtering: 3.18e-03s.
 It.:   3 Obj.:  2.96711642e+02 Vol.:1.2000e-01 Sharp.:3.9055e-01 Cons.:-1.49e-08 Ch.:2.00e-01
 It.:    3 (Time)... Total per-It.: 1.64e+00s; CG: 1.63e+00s; Opti.: 4.59e-03s; Filtering: 3.55e-03s.
 It.:   4 Obj.:  2.48019398e+02 Vol.:1.2000e-01 Sharp.:3.8916e-01 Cons.:5.22e-08 Ch.:2.00e-01
 It.:    4 (Time)... Total per-It.: 1.65e+00s; CG: 1.64e+00s; Opti.: 6.85e-03s; Filtering: 4.93e-03s.
 It.:   5 Obj.:  2.04496753e+02 Vol.:1.2000e-01 Sharp.:3.7343e-01 Cons.:-2.24e-08 Ch.:2.00e-01
 It.:    5 (Time)... Total per-It.: 9.37e-01s; CG: 9.32e-01s; Opti.: 4.48e-03s; Filtering: 3.27e-03s.
 It.:   6 Obj.:  1.69942017e+02 Vol.:1.2000e-01 Sharp.:3.6910e-01 Cons.:5.22e-08 Ch.:2.00e-01
 It.:    6 (Time)... Total per-It.: 1.64e+00s; CG: 1.63e+00s; Opti.: 6.60e-03s; Filtering: 4.68e-03s.
 It.:   7 Obj.:  1.35858414e+02 Vol.:1.2000e-01 Sharp.:3.5070e-01 Cons.:3.73e-08 Ch.:2.00e-01
 It.:    7 (Time)... Total per-It.: 1.60e+00s; CG: 1.60e+00s; Opti.: 4.15e-03s; Filtering: 3.07e-03s.
 It.:   8 Obj.:  1.04408276e+02 Vol.:1.2000e-01 Sharp.:3.3233e-01 Cons.:-3.73e-08 Ch.:2.00e-01
 It.:    8 (Time)... Total per-It.: 1.63e+00s; CG: 1.63e+00s; Opti.: 4.60e-03s; Filtering: 3.40e-03s.
 It.:   9 Obj.:  7.20545967e+01 Vol.:1.2000e-01 Sharp.:3.0036e-01 Cons.:7.45e-08 Ch.:2.00e-01
 It.:    9 (Time)... Total per-It.: 1.63e+00s; CG: 1.63e+00s; Opti.: 4.31e-03s; Filtering: 3.11e-03s.
 It.:  10 Obj.:  4.56048826e+01 Vol.:1.2000e-01 Sharp.:2.6506e-01 Cons.:3.73e-08 Ch.:2.00e-01
 It.:   10 (Time)... Total per-It.: 1.65e+00s; CG: 1.64e+00s; Opti.: 4.01e-03s; Filtering: 2.83e-03s.
 It.:  11 Obj.:  3.28864925e+01 Vol.:1.2000e-01 Sharp.:2.2725e-01 Cons.:-3.73e-08 Ch.:2.00e-01
 It.:   11 (Time)... Total per-It.: 1.64e+00s; CG: 1.63e+00s; Opti.: 4.04e-03s; Filtering: 2.81e-03s.
 It.:  12 Obj.:  2.40270228e+01 Vol.:1.2000e-01 Sharp.:1.9493e-01 Cons.:7.45e-09 Ch.:2.00e-01
 It.:   12 (Time)... Total per-It.: 1.64e+00s; CG: 1.63e+00s; Opti.: 3.92e-03s; Filtering: 2.70e-03s.
 It.:  13 Obj.:  1.92476678e+01 Vol.:1.2000e-01 Sharp.:1.7023e-01 Cons.:-4.47e-08 Ch.:2.00e-01
 It.:   13 (Time)... Total per-It.: 1.64e+00s; CG: 1.63e+00s; Opti.: 3.91e-03s; Filtering: 2.79e-03s.
 It.:  14 Obj.:  1.66120010e+01 Vol.:1.2000e-01 Sharp.:1.5463e-01 Cons.:5.22e-08 Ch.:2.00e-01
 It.:   14 (Time)... Total per-It.: 1.64e+00s; CG: 1.64e+00s; Opti.: 3.47e-03s; Filtering: 2.34e-03s.
 It.:  15 Obj.:  1.70680329e+01 Vol.:1.2000e-01 Sharp.:1.4412e-01 Cons.:-2.98e-08 Ch.:2.00e-01
 It.:   15 (Time)... Total per-It.: 1.64e+00s; CG: 1.64e+00s; Opti.: 3.81e-03s; Filtering: 2.55e-03s.
 It.:  16 Obj.:  1.82684197e+01 Vol.:1.2000e-01 Sharp.:1.3729e-01 Cons.:5.22e-08 Ch.:2.00e-01
 It.:   16 (Time)... Total per-It.: 1.64e+00s; CG: 1.64e+00s; Opti.: 6.22e-03s; Filtering: 3.94e-03s.
 It.:  17 Obj.:  2.00538763e+01 Vol.:1.2000e-01 Sharp.:1.3466e-01 Cons.:7.45e-09 Ch.:2.00e-01
 It.:   17 (Time)... Total per-It.: 1.64e+00s; CG: 1.64e+00s; Opti.: 5.59e-03s; Filtering: 3.63e-03s.
 It.:  18 Obj.:  1.80483171e+01 Vol.:1.2000e-01 Sharp.:1.3750e-01 Cons.:2.24e-08 Ch.:2.00e-01
 It.:   18 (Time)... Total per-It.: 1.63e+00s; CG: 1.62e+00s; Opti.: 4.20e-03s; Filtering: 3.02e-03s.
 It.:  19 Obj.:  1.80679509e+01 Vol.:1.2000e-01 Sharp.:1.4027e-01 Cons.:3.73e-08 Ch.:2.00e-01
 It.:   19 (Time)... Total per-It.: 1.63e+00s; CG: 1.62e+00s; Opti.: 4.02e-03s; Filtering: 2.79e-03s.
 It.:  20 Obj.:  1.99851907e+01 Vol.:1.2000e-01 Sharp.:1.4066e-01 Cons.:2.98e-08 Ch.:2.00e-01
 It.:   20 (Time)... Total per-It.: 1.64e+00s; CG: 1.63e+00s; Opti.: 4.21e-03s; Filtering: 2.88e-03s.
 It.:  21 Obj.:  2.69626192e+01 Vol.:1.2000e-01 Sharp.:1.3777e-01 Cons.:4.47e-08 Ch.:2.00e-01
 It.:   21 (Time)... Total per-It.: 1.63e+00s; CG: 1.63e+00s; Opti.: 4.01e-03s; Filtering: 2.88e-03s.
 It.:  22 Obj.:  3.40957715e+01 Vol.:1.2000e-01 Sharp.:1.3180e-01 Cons.:1.49e-08 Ch.:2.00e-01
 It.:   22 (Time)... Total per-It.: 1.63e+00s; CG: 1.62e+00s; Opti.: 4.07e-03s; Filtering: 2.76e-03s.
 It.:  23 Obj.:  3.68027544e+01 Vol.:1.2000e-01 Sharp.:1.2803e-01 Cons.:1.49e-08 Ch.:2.00e-01
 It.:   23 (Time)... Total per-It.: 1.63e+00s; CG: 1.62e+00s; Opti.: 4.03e-03s; Filtering: 2.78e-03s.
 It.:  24 Obj.:  2.88804421e+01 Vol.:1.2000e-01 Sharp.:1.2601e-01 Cons.:2.24e-08 Ch.:2.00e-01
 It.:   24 (Time)... Total per-It.: 1.63e+00s; CG: 1.62e+00s; Opti.: 3.90e-03s; Filtering: 2.79e-03s.
 It.:  25 Obj.:  1.53026264e+03 Vol.:1.2000e-01 Sharp.:1.3011e-01 Cons.:7.45e-09 Ch.:2.00e-01
 It.:   25 (Time)... Total per-It.: 1.64e+00s; CG: 1.63e+00s; Opti.: 5.79e-03s; Filtering: 4.36e-03s.
 It.:  26 Obj.:  5.42989839e+01 Vol.:1.2000e-01 Sharp.:1.2916e-01 Cons.:3.73e-08 Ch.:2.00e-01
 It.:   26 (Time)... Total per-It.: 1.63e+00s; CG: 1.63e+00s; Opti.: 5.41e-03s; Filtering: 4.32e-03s.
 It.:  27 Obj.:  2.50151344e+01 Vol.:1.2000e-01 Sharp.:1.3197e-01 Cons.:7.45e-09 Ch.:2.00e-01
 It.:   27 (Time)... Total per-It.: 1.63e+00s; CG: 1.63e+00s; Opti.: 4.31e-03s; Filtering: 3.14e-03s.
 It.:  28 Obj.:  2.02978268e+01 Vol.:1.2000e-01 Sharp.:1.2765e-01 Cons.:7.45e-09 Ch.:2.00e-01
 It.:   28 (Time)... Total per-It.: 1.63e+00s; CG: 1.63e+00s; Opti.: 3.88e-03s; Filtering: 2.77e-03s.
 It.:  29 Obj.:  2.03469779e+01 Vol.:1.2000e-01 Sharp.:1.2641e-01 Cons.:2.98e-08 Ch.:2.00e-01
 It.:   29 (Time)... Total per-It.: 1.64e+00s; CG: 1.63e+00s; Opti.: 4.03e-03s; Filtering: 2.72e-03s.
 It.:  30 Obj.:            -nan Vol.:7.7930e-02 Sharp.:1.1103e-01 Cons.:-4.21e-02 Ch.:2.00e-01
 It.:   30 (Time)... Total per-It.: 1.68e+00s; CG: 1.64e+00s; Opti.: 3.45e-02s; Filtering: 3.20e-02s.
 It.:  31 Obj.:            -nan Vol.:5.0367e-02 Sharp.:1.0105e-01 Cons.:-6.96e-02 Ch.:2.00e-01
 It.:   31 (Time)... Total per-It.: 1.67e+00s; CG: 1.64e+00s; Opti.: 3.44e-02s; Filtering: 3.19e-02s.
 It.:  32 Obj.:            -nan Vol.:2.8796e-02 Sharp.:7.5999e-02 Cons.:-9.12e-02 Ch.:2.00e-01
 It.:   32 (Time)... Total per-It.: 1.68e+00s; CG: 1.65e+00s; Opti.: 3.43e-02s; Filtering: 3.17e-02s.
 It.:  33 Obj.:            -nan Vol.:1.2182e-02 Sharp.:4.0232e-02 Cons.:-1.08e-01 Ch.:2.00e-01
 It.:   33 (Time)... Total per-It.: 1.68e+00s; CG: 1.65e+00s; Opti.: 3.43e-02s; Filtering: 3.18e-02s.
 It.:  34 Obj.:            -nan Vol.:9.9999e-04 Sharp.:3.9960e-03 Cons.:-1.19e-01 Ch.:1.99e-01
 It.:   34 (Time)... Total per-It.: 1.68e+00s; CG: 1.64e+00s; Opti.: 3.44e-02s; Filtering: 3.19e-02s.

..........Performing Topology Optimization Costs (in total): 5.6752e+01s.

PARAMETERS
original dims: x=64, y=32, z=32
padded dims: x=64, y=32, z=32
v0: 0.12

SOLVING
iterations: 34
cg iterations: 800

RESULTS
compliance solid: 1.251475e+00
objective first: 7.215612e+02
objective last: -nan

TIME
total solver time: 5.478448e+01
time per iter: 1.6208
percentage time spent on cg: 99.42%
percentage time spent on optim: 0.56%
percentage time spent on filtering: 0.46%

THREADS
32

NOTES

STL file saved to: /orcd/home/002/nhirt/AlgorithmEngineering_AltProject/run_tests/test_scaling/out/stl/GLOBAL_20251208_184911_7039470.stl

Done.

............Total runtime time for 1 simulations5.6758e+01s.
