Running Multigrid for 100 200 100 with OMP_NUM_THREADS=32
Output directed to: test_scaling (via scratch_mg_7017824/out)
Running GLOBAL topo-opt on cuboid: 100x200x100, V0=0.12, iters=50
Preconditioner: Multigrid

==========================Displaying Inputs==========================
Simulation: 0
..............................................Volume Fraction: 0.1200
..........................................Filter Radius: 1.7321 Cells
................................................Cell Size: 1.0000e+00
.................................................#CG Iterations:  800
...........................................Youngs Modulus: 1.0000e+00
....................................Youngs Modulus (Min.): 1.0000e-06
...........................................Poissons Ratio: 3.0000e-01
Building Multigrid Hierarchy...
[MG] levels=3 coarsest=25x13x13 dofs=15288
Preparing Voxel-based FEA Model Costs        0.3s
Compliance of Fully Solid Domain:     3.716364e-01
 It.:    0 Solver Time:   36s.

 It.:   1 Obj.:  2.14940953e+02 Vol.:1.2000e-01 Sharp.:4.0549e-01 Cons.:2.24e-08 Ch.:2.00e-01
 It.:    1 (Time)... Total per-It.: 3.34e+01s; CG: 3.33e+01s; Opti.: 1.14e-01s; Filtering: 6.94e-02s.
 It.:   2 Obj.:  3.60292969e+02 Vol.:1.2000e-01 Sharp.:4.0500e-01 Cons.:1.49e-08 Ch.:2.00e-01
 It.:    2 (Time)... Total per-It.: 3.34e+01s; CG: 3.32e+01s; Opti.: 1.04e-01s; Filtering: 6.21e-02s.
 It.:   3 Obj.:  5.06810113e+02 Vol.:1.2000e-01 Sharp.:3.7813e-01 Cons.:-7.45e-08 Ch.:2.00e-01
 It.:    3 (Time)... Total per-It.: 3.36e+01s; CG: 3.35e+01s; Opti.: 1.06e-01s; Filtering: 6.40e-02s.
 It.:   4 Obj.:  5.20855621e+02 Vol.:1.2000e-01 Sharp.:3.8265e-01 Cons.:9.69e-08 Ch.:2.00e-01
 It.:    4 (Time)... Total per-It.: 3.41e+01s; CG: 3.40e+01s; Opti.: 1.16e-01s; Filtering: 7.43e-02s.
 It.:   5 Obj.:  1.20447770e+02 Vol.:1.2000e-01 Sharp.:3.6975e-01 Cons.:-5.22e-08 Ch.:2.00e-01
 It.:    5 (Time)... Total per-It.: 3.17e+01s; CG: 3.15e+01s; Opti.: 1.16e-01s; Filtering: 7.29e-02s.
 It.:   6 Obj.:  6.23142635e+02 Vol.:1.2000e-01 Sharp.:3.5341e-01 Cons.:-2.98e-08 Ch.:2.00e-01
 It.:    6 (Time)... Total per-It.: 3.16e+01s; CG: 3.15e+01s; Opti.: 1.20e-01s; Filtering: 7.78e-02s.
 It.:   7 Obj.:  1.85151198e+03 Vol.:1.2000e-01 Sharp.:3.2599e-01 Cons.:3.73e-08 Ch.:2.00e-01
 It.:    7 (Time)... Total per-It.: 3.34e+01s; CG: 3.32e+01s; Opti.: 1.20e-01s; Filtering: 7.89e-02s.
 It.:   8 Obj.:  2.87034349e+03 Vol.:1.2000e-01 Sharp.:2.7885e-01 Cons.:-5.96e-08 Ch.:2.00e-01
 It.:    8 (Time)... Total per-It.: 3.34e+01s; CG: 3.33e+01s; Opti.: 1.15e-01s; Filtering: 7.33e-02s.
 It.:   9 Obj.:  3.84223913e+03 Vol.:1.2000e-01 Sharp.:2.5778e-01 Cons.:-1.49e-08 Ch.:2.00e-01
 It.:    9 (Time)... Total per-It.: 3.34e+01s; CG: 3.32e+01s; Opti.: 1.13e-01s; Filtering: 7.25e-02s.
 It.:  10 Obj.:  4.96842487e+03 Vol.:1.2000e-01 Sharp.:2.1358e-01 Cons.:0.00e+00 Ch.:2.00e-01
 It.:   10 (Time)... Total per-It.: 3.29e+01s; CG: 3.27e+01s; Opti.: 1.25e-01s; Filtering: 8.30e-02s.
 It.:  11 Obj.:  1.09136337e+04 Vol.:1.2000e-01 Sharp.:1.5556e-01 Cons.:-1.49e-08 Ch.:2.00e-01
 It.:   11 (Time)... Total per-It.: 3.46e+01s; CG: 3.44e+01s; Opti.: 1.23e-01s; Filtering: 7.98e-02s.
 It.:  12 Obj.:  2.02013261e+04 Vol.:1.2000e-01 Sharp.:1.1366e-01 Cons.:3.73e-08 Ch.:2.00e-01
 It.:   12 (Time)... Total per-It.: 3.44e+01s; CG: 3.43e+01s; Opti.: 1.25e-01s; Filtering: 8.47e-02s.
 It.:  13 Obj.:  1.48056434e+04 Vol.:1.2000e-01 Sharp.:9.5082e-02 Cons.:-1.49e-08 Ch.:2.00e-01
 It.:   13 (Time)... Total per-It.: 3.46e+01s; CG: 3.44e+01s; Opti.: 1.26e-01s; Filtering: 8.41e-02s.
 It.:  14 Obj.:  1.50034954e+04 Vol.:1.2000e-01 Sharp.:8.0280e-02 Cons.:3.73e-08 Ch.:2.00e-01
 It.:   14 (Time)... Total per-It.: 3.45e+01s; CG: 3.43e+01s; Opti.: 1.23e-01s; Filtering: 7.94e-02s.
 It.:  15 Obj.:  9.54912075e+03 Vol.:1.2000e-01 Sharp.:8.1103e-02 Cons.:0.00e+00 Ch.:2.00e-01
 It.:   15 (Time)... Total per-It.: 3.29e+01s; CG: 3.28e+01s; Opti.: 1.34e-01s; Filtering: 9.17e-02s.
 It.:  16 Obj.:  4.78032318e+03 Vol.:1.2000e-01 Sharp.:7.4798e-02 Cons.:2.24e-08 Ch.:2.00e-01
 It.:   16 (Time)... Total per-It.: 3.33e+01s; CG: 3.32e+01s; Opti.: 1.32e-01s; Filtering: 9.18e-02s.
 It.:  17 Obj.:  5.11040364e+03 Vol.:1.2000e-01 Sharp.:7.3298e-02 Cons.:1.49e-08 Ch.:2.00e-01
 It.:   17 (Time)... Total per-It.: 3.34e+01s; CG: 3.32e+01s; Opti.: 1.36e-01s; Filtering: 9.23e-02s.
 It.:  18 Obj.:  6.72358860e+03 Vol.:1.2000e-01 Sharp.:7.0459e-02 Cons.:-1.49e-08 Ch.:2.00e-01
 It.:   18 (Time)... Total per-It.: 3.40e+01s; CG: 3.39e+01s; Opti.: 1.22e-01s; Filtering: 8.12e-02s.
 It.:  19 Obj.:  8.89067620e+03 Vol.:1.2000e-01 Sharp.:6.6938e-02 Cons.:0.00e+00 Ch.:2.00e-01
 It.:   19 (Time)... Total per-It.: 3.44e+01s; CG: 3.43e+01s; Opti.: 1.20e-01s; Filtering: 7.94e-02s.
 It.:  20 Obj.:  9.23851097e+03 Vol.:1.2000e-01 Sharp.:6.5764e-02 Cons.:-1.49e-08 Ch.:2.00e-01
 It.:   20 (Time)... Total per-It.: 3.24e+01s; CG: 3.23e+01s; Opti.: 1.28e-01s; Filtering: 8.53e-02s.
 It.:  21 Obj.:  4.57389749e+03 Vol.:1.2000e-01 Sharp.:6.9854e-02 Cons.:-1.49e-08 Ch.:2.00e-01
 It.:   21 (Time)... Total per-It.: 3.23e+01s; CG: 3.21e+01s; Opti.: 1.21e-01s; Filtering: 8.06e-02s.
 It.:  22 Obj.:  4.25009256e+03 Vol.:1.2000e-01 Sharp.:6.9061e-02 Cons.:1.49e-08 Ch.:2.00e-01
 It.:   22 (Time)... Total per-It.: 3.22e+01s; CG: 3.21e+01s; Opti.: 1.29e-01s; Filtering: 8.78e-02s.
 It.:  23 Obj.:  5.02373471e+03 Vol.:1.2000e-01 Sharp.:6.5390e-02 Cons.:0.00e+00 Ch.:2.00e-01
 It.:   23 (Time)... Total per-It.: 3.20e+01s; CG: 3.19e+01s; Opti.: 1.22e-01s; Filtering: 8.02e-02s.
 It.:  24 Obj.:  6.05539090e+03 Vol.:1.2000e-01 Sharp.:5.9204e-02 Cons.:7.45e-09 Ch.:2.00e-01
 It.:   24 (Time)... Total per-It.: 3.27e+01s; CG: 3.26e+01s; Opti.: 1.15e-01s; Filtering: 7.35e-02s.
 It.:  25 Obj.:  6.75532199e+03 Vol.:1.2000e-01 Sharp.:5.4405e-02 Cons.:1.49e-08 Ch.:2.00e-01
 It.:   25 (Time)... Total per-It.: 3.22e+01s; CG: 3.21e+01s; Opti.: 1.27e-01s; Filtering: 8.27e-02s.
 It.:  26 Obj.:  6.02075513e+03 Vol.:1.2000e-01 Sharp.:5.6376e-02 Cons.:0.00e+00 Ch.:2.00e-01
 It.:   26 (Time)... Total per-It.: 3.21e+01s; CG: 3.20e+01s; Opti.: 1.16e-01s; Filtering: 7.44e-02s.
 It.:  27 Obj.:  6.14922826e+03 Vol.:1.2000e-01 Sharp.:5.5835e-02 Cons.:-7.45e-09 Ch.:2.00e-01
 It.:   27 (Time)... Total per-It.: 3.34e+01s; CG: 3.32e+01s; Opti.: 1.26e-01s; Filtering: 8.55e-02s.
 It.:  28 Obj.:  6.65825939e+03 Vol.:1.2000e-01 Sharp.:5.2703e-02 Cons.:0.00e+00 Ch.:2.00e-01
 It.:   28 (Time)... Total per-It.: 3.31e+01s; CG: 3.30e+01s; Opti.: 1.16e-01s; Filtering: 7.56e-02s.
 It.:  29 Obj.:  7.24742460e+03 Vol.:1.2000e-01 Sharp.:4.7463e-02 Cons.:1.49e-08 Ch.:2.00e-01
 It.:   29 (Time)... Total per-It.: 3.28e+01s; CG: 3.26e+01s; Opti.: 1.23e-01s; Filtering: 8.34e-02s.
 It.:  30 Obj.:  7.73082693e+03 Vol.:1.2000e-01 Sharp.:4.3653e-02 Cons.:0.00e+00 Ch.:2.00e-01
 It.:   30 (Time)... Total per-It.: 3.15e+01s; CG: 3.14e+01s; Opti.: 1.12e-01s; Filtering: 7.20e-02s.
 It.:  31 Obj.:  7.82226022e+03 Vol.:1.2000e-01 Sharp.:4.2160e-02 Cons.:7.45e-09 Ch.:2.00e-01
 It.:   31 (Time)... Total per-It.: 3.18e+01s; CG: 3.17e+01s; Opti.: 1.19e-01s; Filtering: 7.96e-02s.
 It.:  32 Obj.:  8.15164427e+03 Vol.:1.2000e-01 Sharp.:4.1771e-02 Cons.:1.49e-08 Ch.:2.00e-01
 It.:   32 (Time)... Total per-It.: 3.19e+01s; CG: 3.18e+01s; Opti.: 1.25e-01s; Filtering: 8.44e-02s.
 It.:  33 Obj.:  8.49419677e+03 Vol.:1.2000e-01 Sharp.:4.1085e-02 Cons.:0.00e+00 Ch.:2.00e-01
 It.:   33 (Time)... Total per-It.: 3.19e+01s; CG: 3.18e+01s; Opti.: 1.19e-01s; Filtering: 7.79e-02s.
 It.:  34 Obj.:  8.81763602e+03 Vol.:1.2000e-01 Sharp.:3.9009e-02 Cons.:0.00e+00 Ch.:2.00e-01
 It.:   34 (Time)... Total per-It.: 3.18e+01s; CG: 3.17e+01s; Opti.: 1.14e-01s; Filtering: 7.38e-02s.
 It.:  35 Obj.:  6.69486911e+03 Vol.:1.2000e-01 Sharp.:4.6769e-02 Cons.:-7.45e-09 Ch.:2.00e-01
 It.:   35 (Time)... Total per-It.: 3.16e+01s; CG: 3.15e+01s; Opti.: 1.24e-01s; Filtering: 8.26e-02s.
 It.:  36 Obj.:  5.03404219e+03 Vol.:1.2000e-01 Sharp.:5.0841e-02 Cons.:-7.45e-09 Ch.:2.00e-01
 It.:   36 (Time)... Total per-It.: 3.21e+01s; CG: 3.19e+01s; Opti.: 1.30e-01s; Filtering: 8.88e-02s.
 It.:  37 Obj.:  5.27945678e+03 Vol.:1.2000e-01 Sharp.:5.1244e-02 Cons.:0.00e+00 Ch.:2.00e-01
 It.:   37 (Time)... Total per-It.: 3.44e+01s; CG: 3.43e+01s; Opti.: 1.09e-01s; Filtering: 6.75e-02s.
 It.:  38 Obj.:  5.65322389e+03 Vol.:1.2000e-01 Sharp.:4.7350e-02 Cons.:0.00e+00 Ch.:2.00e-01
 It.:   38 (Time)... Total per-It.: 3.50e+01s; CG: 3.48e+01s; Opti.: 1.20e-01s; Filtering: 7.93e-02s.
 It.:  39 Obj.:  6.15635281e+03 Vol.:1.2000e-01 Sharp.:4.1485e-02 Cons.:0.00e+00 Ch.:2.00e-01
 It.:   39 (Time)... Total per-It.: 3.55e+01s; CG: 3.54e+01s; Opti.: 1.28e-01s; Filtering: 8.76e-02s.
 It.:  40 Obj.:  3.63031216e+03 Vol.:1.2000e-01 Sharp.:4.9313e-02 Cons.:0.00e+00 Ch.:2.00e-01
 It.:   40 (Time)... Total per-It.: 3.23e+01s; CG: 3.22e+01s; Opti.: 1.35e-01s; Filtering: 9.13e-02s.
 It.:  41 Obj.:  3.01776249e+03 Vol.:1.2000e-01 Sharp.:5.2514e-02 Cons.:0.00e+00 Ch.:2.00e-01
 It.:   41 (Time)... Total per-It.: 3.25e+01s; CG: 3.24e+01s; Opti.: 1.42e-01s; Filtering: 9.92e-02s.
 It.:  42 Obj.:  3.23955622e+03 Vol.:1.2000e-01 Sharp.:5.2355e-02 Cons.:2.24e-08 Ch.:2.00e-01
 It.:   42 (Time)... Total per-It.: 3.26e+01s; CG: 3.25e+01s; Opti.: 1.12e-01s; Filtering: 6.87e-02s.
 It.:  43 Obj.:  3.58561252e+03 Vol.:1.2000e-01 Sharp.:4.9212e-02 Cons.:0.00e+00 Ch.:2.00e-01
 It.:   43 (Time)... Total per-It.: 3.26e+01s; CG: 3.25e+01s; Opti.: 1.11e-01s; Filtering: 6.88e-02s.
 It.:  44 Obj.:  4.01198248e+03 Vol.:1.2000e-01 Sharp.:4.4871e-02 Cons.:7.45e-09 Ch.:2.00e-01
 It.:   44 (Time)... Total per-It.: 3.21e+01s; CG: 3.20e+01s; Opti.: 1.32e-01s; Filtering: 8.88e-02s.
 It.:  45 Obj.:  2.75070920e+03 Vol.:1.2000e-01 Sharp.:5.5620e-02 Cons.:-7.45e-09 Ch.:2.00e-01
 It.:   45 (Time)... Total per-It.: 3.17e+01s; CG: 3.16e+01s; Opti.: 1.26e-01s; Filtering: 8.48e-02s.
 It.:  46 Obj.:  1.02671319e+03 Vol.:1.2000e-01 Sharp.:5.6368e-02 Cons.:0.00e+00 Ch.:2.00e-01
 It.:   46 (Time)... Total per-It.: 3.34e+01s; CG: 3.33e+01s; Opti.: 1.15e-01s; Filtering: 7.41e-02s.
 It.:  47 Obj.:  1.14171639e+03 Vol.:1.2000e-01 Sharp.:5.3317e-02 Cons.:1.49e-08 Ch.:2.00e-01
 It.:   47 (Time)... Total per-It.: 3.45e+01s; CG: 3.43e+01s; Opti.: 1.12e-01s; Filtering: 7.03e-02s.
 It.:  48 Obj.:  1.31559584e+03 Vol.:1.2000e-01 Sharp.:4.7346e-02 Cons.:0.00e+00 Ch.:2.00e-01
 It.:   48 (Time)... Total per-It.: 3.44e+01s; CG: 3.43e+01s; Opti.: 1.21e-01s; Filtering: 7.97e-02s.
 It.:  49 Obj.:  1.50180374e+03 Vol.:1.2000e-01 Sharp.:4.0987e-02 Cons.:7.45e-09 Ch.:2.00e-01
 It.:   49 (Time)... Total per-It.: 3.50e+01s; CG: 3.49e+01s; Opti.: 1.25e-01s; Filtering: 8.13e-02s.
 It.:  50 Obj.:  1.23708335e+03 Vol.:1.2000e-01 Sharp.:4.3223e-02 Cons.:7.45e-09 Ch.:2.00e-01
 It.:   50 (Time)... Total per-It.: 3.37e+01s; CG: 3.35e+01s; Opti.: 1.44e-01s; Filtering: 1.02e-01s.

..........Performing Topology Optimization Costs (in total): 1.6907e+03s.

PARAMETERS
original dims: x=200, y=100, z=100
padded dims: x=200, y=104, z=104
v0: 0.12

SOLVING
iterations: 50
cg iterations: 800

RESULTS
compliance solid: 3.716364e-01
objective first: 2.149409e+02
objective last: 1.237083e+03

TIME
total solver time: 1.648057e+03
time per iter: 33.0861
percentage time spent on cg: 99.62%
percentage time spent on optim: 0.37%
percentage time spent on filtering: 0.24%

THREADS
32

NOTES

STL file saved to: ./out/stl/GLOBAL_20251208_112111_7017824.stl

Done.

............Total runtime time for 1 simulations1.6908e+03s.
