Running Jacobi for 64 128 64 with OMP_NUM_THREADS=8
Output directed to: /home/nhirt/AlgorithmEngineering_AltProject/run_tests/test_parallel (via /out)
TOP3D_PRECOND=jacobi_finest
Running GLOBAL topo-opt on cuboid: 64x128x64, V0=0.12, iters=50

==========================Displaying Inputs==========================
Simulation: 0
..............................................Volume Fraction: 0.1200
..........................................Filter Radius: 1.7321 Cells
................................................Cell Size: 1.0000e+00
.................................................#CG Iterations:  800
...........................................Youngs Modulus: 1.0000e+00
....................................Youngs Modulus (Min.): 1.0000e-06
...........................................Poissons Ratio: 3.0000e-01
Skipping Multigrid (TOP3D_PRECOND=jacobi_finest)
Preparing Voxel-based FEA Model Costs        0.1s
Compliance of Fully Solid Domain:     6.264287e-01
 It.:    0 Solver Time:   11s.

 It.:   1 Obj.:  3.62307281e+02 Vol.:1.2000e-01 Sharp.:4.0555e-01 Cons.:7.45e-09 Ch.:2.00e-01
 It.:    1 (Time)... Total per-It.: 1.10e+01s; CG: 1.09e+01s; Opti.: 5.26e-02s; Filtering: 3.38e-02s.
 It.:   2 Obj.:  2.14190067e+02 Vol.:1.2000e-01 Sharp.:4.0259e-01 Cons.:-1.49e-08 Ch.:2.00e-01
 It.:    2 (Time)... Total per-It.: 1.50e+01s; CG: 1.49e+01s; Opti.: 4.72e-02s; Filtering: 2.91e-02s.
 It.:   3 Obj.:  1.32163181e+02 Vol.:1.2000e-01 Sharp.:3.8963e-01 Cons.:6.71e-08 Ch.:2.00e-01
 It.:    3 (Time)... Total per-It.: 1.47e+01s; CG: 1.46e+01s; Opti.: 4.84e-02s; Filtering: 2.93e-02s.
 It.:   4 Obj.:  1.10844800e+02 Vol.:1.2000e-01 Sharp.:3.8280e-01 Cons.:5.22e-08 Ch.:2.00e-01
 It.:    4 (Time)... Total per-It.: 1.48e+01s; CG: 1.48e+01s; Opti.: 4.41e-02s; Filtering: 2.60e-02s.
 It.:   5 Obj.:  8.34475054e+01 Vol.:1.2000e-01 Sharp.:3.6786e-01 Cons.:6.71e-08 Ch.:2.00e-01
 It.:    5 (Time)... Total per-It.: 1.50e+01s; CG: 1.50e+01s; Opti.: 3.79e-02s; Filtering: 2.19e-02s.
 It.:   6 Obj.:  7.50125516e+01 Vol.:1.2000e-01 Sharp.:3.5686e-01 Cons.:-6.71e-08 Ch.:2.00e-01
 It.:    6 (Time)... Total per-It.: 1.51e+01s; CG: 1.50e+01s; Opti.: 4.41e-02s; Filtering: 2.60e-02s.
 It.:   7 Obj.:  5.96297946e+01 Vol.:1.2000e-01 Sharp.:3.3679e-01 Cons.:-1.49e-08 Ch.:2.00e-01
 It.:    7 (Time)... Total per-It.: 1.51e+01s; CG: 1.50e+01s; Opti.: 4.43e-02s; Filtering: 2.69e-02s.
 It.:   8 Obj.:  4.39965074e+01 Vol.:1.2000e-01 Sharp.:3.0685e-01 Cons.:-2.24e-08 Ch.:2.00e-01
 It.:    8 (Time)... Total per-It.: 1.50e+01s; CG: 1.50e+01s; Opti.: 3.84e-02s; Filtering: 2.17e-02s.
 It.:   9 Obj.:  3.23826444e+01 Vol.:1.2000e-01 Sharp.:2.6017e-01 Cons.:7.45e-09 Ch.:2.00e-01
 It.:    9 (Time)... Total per-It.: 1.50e+01s; CG: 1.50e+01s; Opti.: 4.40e-02s; Filtering: 2.64e-02s.
 It.:  10 Obj.:  2.14627179e+01 Vol.:1.2000e-01 Sharp.:2.1949e-01 Cons.:-3.73e-08 Ch.:2.00e-01
 It.:   10 (Time)... Total per-It.: 1.50e+01s; CG: 1.49e+01s; Opti.: 3.86e-02s; Filtering: 2.15e-02s.
 It.:  11 Obj.:  1.45254730e+01 Vol.:1.2000e-01 Sharp.:1.7064e-01 Cons.:-1.49e-08 Ch.:2.00e-01
 It.:   11 (Time)... Total per-It.: 1.47e+01s; CG: 1.47e+01s; Opti.: 4.41e-02s; Filtering: 2.62e-02s.
 It.:  12 Obj.:  1.03926547e+01 Vol.:1.2000e-01 Sharp.:1.4627e-01 Cons.:7.45e-09 Ch.:2.00e-01
 It.:   12 (Time)... Total per-It.: 1.46e+01s; CG: 1.46e+01s; Opti.: 4.41e-02s; Filtering: 2.55e-02s.
 It.:  13 Obj.:  8.31362714e+00 Vol.:1.2000e-01 Sharp.:1.2174e-01 Cons.:2.24e-08 Ch.:2.00e-01
 It.:   13 (Time)... Total per-It.: 1.49e+01s; CG: 1.49e+01s; Opti.: 3.72e-02s; Filtering: 2.00e-02s.
 It.:  14 Obj.:  7.20779795e+00 Vol.:1.2000e-01 Sharp.:1.0856e-01 Cons.:1.49e-08 Ch.:2.00e-01
 It.:   14 (Time)... Total per-It.: 1.47e+01s; CG: 1.47e+01s; Opti.: 4.18e-02s; Filtering: 2.32e-02s.
 It.:  15 Obj.:  6.46918583e+00 Vol.:1.2000e-01 Sharp.:9.6499e-02 Cons.:3.73e-08 Ch.:2.00e-01
 It.:   15 (Time)... Total per-It.: 1.47e+01s; CG: 1.46e+01s; Opti.: 3.56e-02s; Filtering: 1.90e-02s.
 It.:  16 Obj.:  6.10031456e+00 Vol.:1.2000e-01 Sharp.:8.9833e-02 Cons.:7.45e-09 Ch.:2.00e-01
 It.:   16 (Time)... Total per-It.: 1.48e+01s; CG: 1.48e+01s; Opti.: 3.25e-02s; Filtering: 1.54e-02s.
 It.:  17 Obj.:  5.80468454e+00 Vol.:1.2000e-01 Sharp.:8.4605e-02 Cons.:2.98e-08 Ch.:2.00e-01
 It.:   17 (Time)... Total per-It.: 1.48e+01s; CG: 1.47e+01s; Opti.: 3.30e-02s; Filtering: 1.58e-02s.
 It.:  18 Obj.:  5.63529653e+00 Vol.:1.2000e-01 Sharp.:8.1343e-02 Cons.:-7.45e-09 Ch.:2.00e-01
 It.:   18 (Time)... Total per-It.: 1.48e+01s; CG: 1.47e+01s; Opti.: 3.74e-02s; Filtering: 2.05e-02s.
 It.:  19 Obj.:  5.50524515e+00 Vol.:1.2000e-01 Sharp.:8.0123e-02 Cons.:0.00e+00 Ch.:1.52e-01
 It.:   19 (Time)... Total per-It.: 1.48e+01s; CG: 1.47e+01s; Opti.: 2.59e-02s; Filtering: 9.23e-03s.
 It.:  20 Obj.:  5.41868468e+00 Vol.:1.2000e-01 Sharp.:7.8927e-02 Cons.:-7.45e-09 Ch.:2.00e-01
 It.:   20 (Time)... Total per-It.: 1.47e+01s; CG: 1.47e+01s; Opti.: 3.29e-02s; Filtering: 1.55e-02s.
 It.:  21 Obj.:  5.38954651e+00 Vol.:1.2000e-01 Sharp.:7.8389e-02 Cons.:2.98e-08 Ch.:1.59e-01
 It.:   21 (Time)... Total per-It.: 1.48e+01s; CG: 1.47e+01s; Opti.: 2.65e-02s; Filtering: 9.77e-03s.
 It.:  22 Obj.:  5.36171593e+00 Vol.:1.2000e-01 Sharp.:7.7991e-02 Cons.:-2.98e-08 Ch.:2.00e-01
 It.:   22 (Time)... Total per-It.: 1.46e+01s; CG: 1.46e+01s; Opti.: 3.77e-02s; Filtering: 2.08e-02s.
 It.:  23 Obj.:  5.35030549e+00 Vol.:1.2000e-01 Sharp.:7.7765e-02 Cons.:-2.24e-08 Ch.:2.00e-01
 It.:   23 (Time)... Total per-It.: 1.47e+01s; CG: 1.47e+01s; Opti.: 2.58e-02s; Filtering: 9.12e-03s.
 It.:  24 Obj.:  5.33357840e+00 Vol.:1.2000e-01 Sharp.:7.7714e-02 Cons.:-1.49e-08 Ch.:2.00e-01
 It.:   24 (Time)... Total per-It.: 1.46e+01s; CG: 1.46e+01s; Opti.: 3.36e-02s; Filtering: 1.63e-02s.
 It.:  25 Obj.:  5.31229857e+00 Vol.:1.2000e-01 Sharp.:7.7565e-02 Cons.:2.24e-08 Ch.:2.00e-01
 It.:   25 (Time)... Total per-It.: 1.47e+01s; CG: 1.47e+01s; Opti.: 2.57e-02s; Filtering: 9.12e-03s.
 It.:  26 Obj.:  5.29924520e+00 Vol.:1.2000e-01 Sharp.:7.7464e-02 Cons.:7.45e-09 Ch.:2.00e-01
 It.:   26 (Time)... Total per-It.: 1.47e+01s; CG: 1.47e+01s; Opti.: 2.50e-02s; Filtering: 9.19e-03s.
 It.:  27 Obj.:  5.29444991e+00 Vol.:1.2000e-01 Sharp.:7.7428e-02 Cons.:-7.45e-09 Ch.:2.00e-01
 It.:   27 (Time)... Total per-It.: 1.48e+01s; CG: 1.47e+01s; Opti.: 3.88e-02s; Filtering: 2.02e-02s.
 It.:  28 Obj.:  5.28587321e+00 Vol.:1.2000e-01 Sharp.:7.7290e-02 Cons.:0.00e+00 Ch.:2.00e-01
 It.:   28 (Time)... Total per-It.: 1.48e+01s; CG: 1.47e+01s; Opti.: 2.60e-02s; Filtering: 8.68e-03s.
 It.:  29 Obj.:  5.27860025e+00 Vol.:1.2000e-01 Sharp.:7.7418e-02 Cons.:-2.24e-08 Ch.:2.00e-01
 It.:   29 (Time)... Total per-It.: 1.47e+01s; CG: 1.47e+01s; Opti.: 3.87e-02s; Filtering: 2.05e-02s.
 It.:  30 Obj.:  5.26304654e+00 Vol.:1.2000e-01 Sharp.:7.7295e-02 Cons.:0.00e+00 Ch.:2.00e-01
 It.:   30 (Time)... Total per-It.: 1.48e+01s; CG: 1.48e+01s; Opti.: 2.47e-02s; Filtering: 9.28e-03s.
 It.:  31 Obj.:  5.25238995e+00 Vol.:1.2000e-01 Sharp.:7.7219e-02 Cons.:-7.45e-09 Ch.:2.00e-01
 It.:   31 (Time)... Total per-It.: 1.47e+01s; CG: 1.47e+01s; Opti.: 2.66e-02s; Filtering: 9.91e-03s.
 It.:  32 Obj.:  5.25053975e+00 Vol.:1.2000e-01 Sharp.:7.7192e-02 Cons.:-7.45e-09 Ch.:2.00e-01
 It.:   32 (Time)... Total per-It.: 1.47e+01s; CG: 1.47e+01s; Opti.: 3.23e-02s; Filtering: 1.51e-02s.
 It.:  33 Obj.:  5.23883917e+00 Vol.:1.2000e-01 Sharp.:7.7039e-02 Cons.:2.24e-08 Ch.:2.00e-01
 It.:   33 (Time)... Total per-It.: 1.47e+01s; CG: 1.46e+01s; Opti.: 2.60e-02s; Filtering: 9.35e-03s.
 It.:  34 Obj.:  5.23446980e+00 Vol.:1.2000e-01 Sharp.:7.7241e-02 Cons.:7.45e-09 Ch.:2.00e-01
 It.:   34 (Time)... Total per-It.: 1.48e+01s; CG: 1.47e+01s; Opti.: 3.73e-02s; Filtering: 2.05e-02s.
 It.:  35 Obj.:  5.22250959e+00 Vol.:1.2000e-01 Sharp.:7.7101e-02 Cons.:-1.49e-08 Ch.:2.00e-01
 It.:   35 (Time)... Total per-It.: 1.48e+01s; CG: 1.47e+01s; Opti.: 2.59e-02s; Filtering: 9.24e-03s.
 It.:  36 Obj.:  5.21653574e+00 Vol.:1.2000e-01 Sharp.:7.7071e-02 Cons.:-2.24e-08 Ch.:2.00e-01
 It.:   36 (Time)... Total per-It.: 1.48e+01s; CG: 1.47e+01s; Opti.: 3.17e-02s; Filtering: 1.62e-02s.
 It.:  37 Obj.:  5.20119741e+00 Vol.:1.2000e-01 Sharp.:7.6957e-02 Cons.:1.49e-08 Ch.:2.00e-01
 It.:   37 (Time)... Total per-It.: 1.47e+01s; CG: 1.47e+01s; Opti.: 2.77e-02s; Filtering: 9.18e-03s.
 It.:  38 Obj.:  5.20297373e+00 Vol.:1.2000e-01 Sharp.:7.7284e-02 Cons.:1.49e-08 Ch.:2.00e-01
 It.:   38 (Time)... Total per-It.: 1.48e+01s; CG: 1.48e+01s; Opti.: 3.15e-02s; Filtering: 1.61e-02s.
 It.:  39 Obj.:  5.18696806e+00 Vol.:1.2000e-01 Sharp.:7.7116e-02 Cons.:-7.45e-09 Ch.:2.00e-01
 It.:   39 (Time)... Total per-It.: 1.47e+01s; CG: 1.47e+01s; Opti.: 2.69e-02s; Filtering: 9.81e-03s.
 It.:  40 Obj.:  5.18849419e+00 Vol.:1.2000e-01 Sharp.:7.7182e-02 Cons.:2.24e-08 Ch.:2.00e-01
 It.:   40 (Time)... Total per-It.: 1.48e+01s; CG: 1.47e+01s; Opti.: 3.69e-02s; Filtering: 1.98e-02s.
 It.:  41 Obj.:  5.18935514e+00 Vol.:1.2000e-01 Sharp.:7.6980e-02 Cons.:3.73e-08 Ch.:2.00e-01
 It.:   41 (Time)... Total per-It.: 1.47e+01s; CG: 1.47e+01s; Opti.: 2.60e-02s; Filtering: 9.41e-03s.
 It.:  42 Obj.:  5.18379716e+00 Vol.:1.2000e-01 Sharp.:7.7169e-02 Cons.:-7.45e-09 Ch.:2.00e-01
 It.:   42 (Time)... Total per-It.: 1.48e+01s; CG: 1.47e+01s; Opti.: 3.24e-02s; Filtering: 1.52e-02s.
 It.:  43 Obj.:  5.16708353e+00 Vol.:1.2000e-01 Sharp.:7.6928e-02 Cons.:0.00e+00 Ch.:2.00e-01
 It.:   43 (Time)... Total per-It.: 1.49e+01s; CG: 1.49e+01s; Opti.: 2.81e-02s; Filtering: 1.12e-02s.
 It.:  44 Obj.:  5.15705753e+00 Vol.:1.2000e-01 Sharp.:7.7040e-02 Cons.:1.49e-08 Ch.:2.00e-01
 It.:   44 (Time)... Total per-It.: 1.52e+01s; CG: 1.51e+01s; Opti.: 3.73e-02s; Filtering: 2.04e-02s.
 It.:  45 Obj.:  5.16586869e+00 Vol.:1.2000e-01 Sharp.:7.6799e-02 Cons.:-7.45e-09 Ch.:2.00e-01
 It.:   45 (Time)... Total per-It.: 1.49e+01s; CG: 1.49e+01s; Opti.: 2.61e-02s; Filtering: 9.37e-03s.
 It.:  46 Obj.:  5.15889871e+00 Vol.:1.2000e-01 Sharp.:7.6794e-02 Cons.:2.98e-08 Ch.:2.00e-01
 It.:   46 (Time)... Total per-It.: 1.47e+01s; CG: 1.47e+01s; Opti.: 3.30e-02s; Filtering: 1.56e-02s.
 It.:  47 Obj.:  5.14328349e+00 Vol.:1.2000e-01 Sharp.:7.6521e-02 Cons.:2.24e-08 Ch.:2.00e-01
 It.:   47 (Time)... Total per-It.: 1.48e+01s; CG: 1.48e+01s; Opti.: 2.64e-02s; Filtering: 9.76e-03s.
 It.:  48 Obj.:  5.12911217e+00 Vol.:1.2000e-01 Sharp.:7.6576e-02 Cons.:3.73e-08 Ch.:2.00e-01
 It.:   48 (Time)... Total per-It.: 1.48e+01s; CG: 1.48e+01s; Opti.: 3.78e-02s; Filtering: 2.08e-02s.
 It.:  49 Obj.:  5.12763586e+00 Vol.:1.2000e-01 Sharp.:7.6382e-02 Cons.:-7.45e-09 Ch.:2.00e-01
 It.:   49 (Time)... Total per-It.: 1.48e+01s; CG: 1.47e+01s; Opti.: 2.61e-02s; Filtering: 9.53e-03s.
 It.:  50 Obj.:  5.12480086e+00 Vol.:1.2000e-01 Sharp.:7.6212e-02 Cons.:-2.24e-08 Ch.:2.00e-01
 It.:   50 (Time)... Total per-It.: 1.47e+01s; CG: 1.47e+01s; Opti.: 3.24e-02s; Filtering: 1.51e-02s.

..........Performing Topology Optimization Costs (in total): 7.4694e+02s.

PARAMETERS
original dims: x=128, y=64, z=64
padded dims: x=128, y=64, z=64
v0: 0.12

SOLVING
iterations: 50
cg iterations: 800

RESULTS
compliance solid: 6.264287e-01
objective first: 3.623073e+02
objective last: 5.124801e+00

TIME
total solver time: 7.341388e+02
time per iter: 14.7198
percentage time spent on cg: 99.75%
percentage time spent on optim: 0.23%
percentage time spent on filtering: 0.12%

THREADS
8

NOTES

STL file saved to: /orcd/home/002/nhirt/AlgorithmEngineering_AltProject/run_tests/test_parallel/out/stl/GLOBAL_20251209_035941_7043779.stl

Done.

............Total runtime time for 1 simulations7.4698e+02s.
