Running Multigrid for 64 128 64 with OMP_NUM_THREADS=8
Output directed to: /home/nhirt/AlgorithmEngineering_AltProject/run_tests/test_parallel (cwd=/home/nhirt/AlgorithmEngineering_AltProject/run_tests/test_parallel)
TOP3D_PRECOND=mg
Running GLOBAL topo-opt on cuboid: 64x128x64, V0=0.12, iters=50

==========================Displaying Inputs==========================
Simulation: 0
..............................................Volume Fraction: 0.1200
..........................................Filter Radius: 1.7321 Cells
................................................Cell Size: 1.0000e+00
.................................................#CG Iterations:  800
...........................................Youngs Modulus: 1.0000e+00
....................................Youngs Modulus (Min.): 1.0000e-06
...........................................Poissons Ratio: 3.0000e-01
Building Multigrid Hierarchy...
[MG] levels=5 coarsest=4x2x2 dofs=135
Preparing Voxel-based FEA Model Costs        0.1s
Compliance of Fully Solid Domain:     6.262408e-01
 It.:    0 Solver Time:   15s.

 It.:   1 Obj.:  3.62427134e+02 Vol.:1.2000e-01 Sharp.:4.0556e-01 Cons.:-8.20e-08 Ch.:2.00e-01
 It.:    1 (Time)... Total per-It.: 1.43e+01s; CG: 1.43e+01s; Opti.: 4.90e-02s; Filtering: 3.28e-02s.
 It.:   2 Obj.:  2.16391532e+02 Vol.:1.2000e-01 Sharp.:4.0250e-01 Cons.:5.22e-08 Ch.:2.00e-01
 It.:    2 (Time)... Total per-It.: 1.81e+01s; CG: 1.80e+01s; Opti.: 4.77e-02s; Filtering: 3.10e-02s.
 It.:   3 Obj.:  1.17657815e+02 Vol.:1.2000e-01 Sharp.:3.8198e-01 Cons.:2.98e-08 Ch.:2.00e-01
 It.:    3 (Time)... Total per-It.: 1.72e+01s; CG: 1.71e+01s; Opti.: 4.86e-02s; Filtering: 3.17e-02s.
 It.:   4 Obj.:  1.45370121e+02 Vol.:1.2000e-01 Sharp.:3.8640e-01 Cons.:-5.22e-08 Ch.:2.00e-01
 It.:    4 (Time)... Total per-It.: 1.62e+01s; CG: 1.61e+01s; Opti.: 4.43e-02s; Filtering: 2.75e-02s.
 It.:   5 Obj.:  9.35031239e+01 Vol.:1.2000e-01 Sharp.:3.6426e-01 Cons.:7.45e-09 Ch.:2.00e-01
 It.:    5 (Time)... Total per-It.: 1.63e+01s; CG: 1.63e+01s; Opti.: 4.37e-02s; Filtering: 2.73e-02s.
 It.:   6 Obj.:  7.44403697e+01 Vol.:1.2000e-01 Sharp.:3.5710e-01 Cons.:7.45e-08 Ch.:2.00e-01
 It.:    6 (Time)... Total per-It.: 1.63e+01s; CG: 1.63e+01s; Opti.: 3.85e-02s; Filtering: 2.23e-02s.
 It.:   7 Obj.:  5.28500551e+01 Vol.:1.2000e-01 Sharp.:3.2604e-01 Cons.:-3.73e-08 Ch.:2.00e-01
 It.:    7 (Time)... Total per-It.: 1.74e+01s; CG: 1.74e+01s; Opti.: 4.13e-02s; Filtering: 2.48e-02s.
 It.:   8 Obj.:  4.02475010e+01 Vol.:1.2000e-01 Sharp.:3.0157e-01 Cons.:4.47e-08 Ch.:2.00e-01
 It.:    8 (Time)... Total per-It.: 1.95e+01s; CG: 1.95e+01s; Opti.: 3.97e-02s; Filtering: 2.41e-02s.
 It.:   9 Obj.:  2.89701450e+01 Vol.:1.2000e-01 Sharp.:2.6361e-01 Cons.:5.96e-08 Ch.:2.00e-01
 It.:    9 (Time)... Total per-It.: 2.09e+01s; CG: 2.09e+01s; Opti.: 4.13e-02s; Filtering: 2.52e-02s.
 It.:  10 Obj.:  1.59029226e+01 Vol.:1.2000e-01 Sharp.:2.0502e-01 Cons.:-2.24e-08 Ch.:2.00e-01
 It.:   10 (Time)... Total per-It.: 1.84e+01s; CG: 1.84e+01s; Opti.: 3.87e-02s; Filtering: 2.31e-02s.
 It.:  11 Obj.:  1.06191255e+01 Vol.:1.2000e-01 Sharp.:1.5937e-01 Cons.:2.24e-08 Ch.:2.00e-01
 It.:   11 (Time)... Total per-It.: 1.67e+01s; CG: 1.67e+01s; Opti.: 3.46e-02s; Filtering: 1.90e-02s.
 It.:  12 Obj.:  8.41055998e+00 Vol.:1.2000e-01 Sharp.:1.2824e-01 Cons.:-3.73e-08 Ch.:2.00e-01
 It.:   12 (Time)... Total per-It.: 1.62e+01s; CG: 1.62e+01s; Opti.: 3.86e-02s; Filtering: 2.19e-02s.
 It.:  13 Obj.:  7.82378366e+00 Vol.:1.2000e-01 Sharp.:1.0866e-01 Cons.:1.49e-08 Ch.:2.00e-01
 It.:   13 (Time)... Total per-It.: 1.63e+01s; CG: 1.62e+01s; Opti.: 3.83e-02s; Filtering: 2.17e-02s.
 It.:  14 Obj.:  8.45168946e+00 Vol.:1.2000e-01 Sharp.:9.7562e-02 Cons.:3.73e-08 Ch.:2.00e-01
 It.:   14 (Time)... Total per-It.: 1.62e+01s; CG: 1.62e+01s; Opti.: 3.51e-02s; Filtering: 1.97e-02s.
 It.:  15 Obj.:  6.04907757e+00 Vol.:1.2000e-01 Sharp.:8.8953e-02 Cons.:2.24e-08 Ch.:2.00e-01
 It.:   15 (Time)... Total per-It.: 1.63e+01s; CG: 1.63e+01s; Opti.: 4.08e-02s; Filtering: 2.14e-02s.
 It.:  16 Obj.:  5.74732162e+00 Vol.:1.2000e-01 Sharp.:8.4745e-02 Cons.:2.24e-08 Ch.:2.00e-01
 It.:   16 (Time)... Total per-It.: 1.63e+01s; CG: 1.63e+01s; Opti.: 3.38e-02s; Filtering: 1.65e-02s.
 It.:  17 Obj.:  5.52718152e+00 Vol.:1.2000e-01 Sharp.:8.2330e-02 Cons.:2.24e-08 Ch.:2.00e-01
 It.:   17 (Time)... Total per-It.: 1.66e+01s; CG: 1.66e+01s; Opti.: 3.23e-02s; Filtering: 1.67e-02s.
 It.:  18 Obj.:  5.45313933e+00 Vol.:1.2000e-01 Sharp.:8.1263e-02 Cons.:-1.49e-08 Ch.:1.51e-01
 It.:   18 (Time)... Total per-It.: 1.75e+01s; CG: 1.74e+01s; Opti.: 2.69e-02s; Filtering: 9.64e-03s.
 It.:  19 Obj.:  5.39806311e+00 Vol.:1.2000e-01 Sharp.:8.0281e-02 Cons.:1.49e-08 Ch.:2.00e-01
 It.:   19 (Time)... Total per-It.: 1.71e+01s; CG: 1.71e+01s; Opti.: 3.23e-02s; Filtering: 1.69e-02s.
 It.:  20 Obj.:  5.41414272e+00 Vol.:1.2000e-01 Sharp.:7.9786e-02 Cons.:7.45e-09 Ch.:2.00e-01
 It.:   20 (Time)... Total per-It.: 1.86e+01s; CG: 1.86e+01s; Opti.: 2.85e-02s; Filtering: 1.23e-02s.
 It.:  21 Obj.:  5.39793775e+00 Vol.:1.2000e-01 Sharp.:7.9531e-02 Cons.:1.49e-08 Ch.:8.58e-02
 It.:   21 (Time)... Total per-It.: 2.03e+01s; CG: 2.03e+01s; Opti.: 2.66e-02s; Filtering: 1.06e-02s.
 It.:  22 Obj.:  5.39438410e+00 Vol.:1.2000e-01 Sharp.:7.9020e-02 Cons.:2.98e-08 Ch.:2.00e-01
 It.:   22 (Time)... Total per-It.: 1.81e+01s; CG: 1.81e+01s; Opti.: 3.15e-02s; Filtering: 1.60e-02s.
 It.:  23 Obj.:  5.36256846e+00 Vol.:1.2000e-01 Sharp.:7.8670e-02 Cons.:-2.24e-08 Ch.:2.00e-01
 It.:   23 (Time)... Total per-It.: 1.66e+01s; CG: 1.66e+01s; Opti.: 2.54e-02s; Filtering: 9.79e-03s.
 It.:  24 Obj.:  5.34884379e+00 Vol.:1.2000e-01 Sharp.:7.8439e-02 Cons.:1.49e-08 Ch.:2.00e-01
 It.:   24 (Time)... Total per-It.: 1.63e+01s; CG: 1.63e+01s; Opti.: 2.47e-02s; Filtering: 9.40e-03s.
 It.:  25 Obj.:  5.34556583e+00 Vol.:1.2000e-01 Sharp.:7.7912e-02 Cons.:0.00e+00 Ch.:2.00e-01
 It.:   25 (Time)... Total per-It.: 1.68e+01s; CG: 1.67e+01s; Opti.: 3.47e-02s; Filtering: 1.60e-02s.
 It.:  26 Obj.:  5.30260704e+00 Vol.:1.2000e-01 Sharp.:7.7523e-02 Cons.:0.00e+00 Ch.:2.00e-01
 It.:   26 (Time)... Total per-It.: 1.65e+01s; CG: 1.64e+01s; Opti.: 2.56e-02s; Filtering: 8.57e-03s.
 It.:  27 Obj.:  5.29895620e+00 Vol.:1.2000e-01 Sharp.:7.7257e-02 Cons.:3.73e-08 Ch.:2.00e-01
 It.:   27 (Time)... Total per-It.: 1.63e+01s; CG: 1.62e+01s; Opti.: 2.54e-02s; Filtering: 9.85e-03s.
 It.:  28 Obj.:  5.32415381e+00 Vol.:1.2000e-01 Sharp.:7.6418e-02 Cons.:2.98e-08 Ch.:2.00e-01
 It.:   28 (Time)... Total per-It.: 1.85e+01s; CG: 1.85e+01s; Opti.: 3.60e-02s; Filtering: 1.82e-02s.
 It.:  29 Obj.:  5.23309768e+00 Vol.:1.2000e-01 Sharp.:7.6030e-02 Cons.:-1.49e-08 Ch.:2.00e-01
 It.:   29 (Time)... Total per-It.: 2.01e+01s; CG: 2.00e+01s; Opti.: 3.31e-02s; Filtering: 1.76e-02s.
 It.:  30 Obj.:  5.22964624e+00 Vol.:1.2000e-01 Sharp.:7.6042e-02 Cons.:-2.24e-08 Ch.:1.93e-01
 It.:   30 (Time)... Total per-It.: 2.02e+01s; CG: 2.02e+01s; Opti.: 2.64e-02s; Filtering: 9.60e-03s.
 It.:  31 Obj.:  5.22600968e+00 Vol.:1.2000e-01 Sharp.:7.6060e-02 Cons.:2.98e-08 Ch.:6.24e-02
 It.:   31 (Time)... Total per-It.: 1.80e+01s; CG: 1.80e+01s; Opti.: 3.09e-02s; Filtering: 1.10e-02s.
 It.:  32 Obj.:  5.22455453e+00 Vol.:1.2000e-01 Sharp.:7.6068e-02 Cons.:2.24e-08 Ch.:2.96e-02
 It.:   32 (Time)... Total per-It.: 1.57e+01s; CG: 1.57e+01s; Opti.: 2.58e-02s; Filtering: 9.22e-03s.
 It.:  33 Obj.:  5.22393838e+00 Vol.:1.2000e-01 Sharp.:7.6072e-02 Cons.:7.45e-09 Ch.:1.51e-02
 It.:   33 (Time)... Total per-It.: 1.01e+01s; CG: 1.01e+01s; Opti.: 2.80e-02s; Filtering: 9.26e-03s.
 It.:  34 Obj.:  5.22356205e+00 Vol.:1.2000e-01 Sharp.:7.6074e-02 Cons.:-1.49e-08 Ch.:7.65e-03
 It.:   34 (Time)... Total per-It.: 8.68e+00s; CG: 8.66e+00s; Opti.: 2.58e-02s; Filtering: 9.25e-03s.
 It.:  35 Obj.:  5.22302640e+00 Vol.:1.2000e-01 Sharp.:7.6075e-02 Cons.:-1.49e-08 Ch.:3.85e-03
 It.:   35 (Time)... Total per-It.: 3.74e+00s; CG: 3.71e+00s; Opti.: 2.58e-02s; Filtering: 1.02e-02s.
 It.:  36 Obj.:  5.22274266e+00 Vol.:1.2000e-01 Sharp.:7.6076e-02 Cons.:2.98e-08 Ch.:1.93e-03
 It.:   36 (Time)... Total per-It.: 4.77e+00s; CG: 4.73e+00s; Opti.: 2.61e-02s; Filtering: 1.05e-02s.
 It.:  37 Obj.:  5.22308827e+00 Vol.:1.2000e-01 Sharp.:7.6076e-02 Cons.:3.73e-08 Ch.:9.65e-04
 It.:   37 (Time)... Total per-It.: 5.93e-01s; CG: 5.64e-01s; Opti.: 2.52e-02s; Filtering: 9.67e-03s.
 It.:  38 Obj.:  5.22316441e+00 Vol.:1.2000e-01 Sharp.:7.6076e-02 Cons.:-7.45e-09 Ch.:4.83e-04
 It.:   38 (Time)... Total per-It.: 2.47e-01s; CG: 2.17e-01s; Opti.: 2.63e-02s; Filtering: 9.10e-03s.
 It.:  39 Obj.:  5.22318399e+00 Vol.:1.2000e-01 Sharp.:7.6076e-02 Cons.:-2.24e-08 Ch.:2.42e-04
 It.:   39 (Time)... Total per-It.: 1.05e-01s; CG: 7.58e-02s; Opti.: 2.60e-02s; Filtering: 1.03e-02s.
 It.:  40 Obj.:  5.22343000e+00 Vol.:1.2000e-01 Sharp.:7.6076e-02 Cons.:-2.24e-08 Ch.:1.21e-04
 It.:   40 (Time)... Total per-It.: 4.88e-01s; CG: 4.59e-01s; Opti.: 2.51e-02s; Filtering: 9.73e-03s.
 It.:  41 Obj.:  5.22343312e+00 Vol.:1.2000e-01 Sharp.:7.6076e-02 Cons.:-2.24e-08 Ch.:6.04e-05
 It.:   41 (Time)... Total per-It.: 6.46e-02s; CG: 3.60e-02s; Opti.: 2.48e-02s; Filtering: 9.45e-03s.

..........Performing Topology Optimization Costs (in total): 5.9957e+02s.

PARAMETERS
original dims: x=128, y=64, z=64
padded dims: x=128, y=64, z=64
v0: 0.12

SOLVING
iterations: 41
cg iterations: 800

RESULTS
compliance solid: 6.262408e-01
objective first: 3.624271e+02
objective last: 5.223433e+00

TIME
total solver time: 5.832539e+02
time per iter: 14.2606
percentage time spent on cg: 99.76%
percentage time spent on optim: 0.23%
percentage time spent on filtering: 0.12%

THREADS
8

NOTES

STL file saved to: /orcd/home/002/nhirt/AlgorithmEngineering_AltProject/run_tests/test_parallel/out/stl/GLOBAL_20251209_034714_7043777.stl

Done.

............Total runtime time for 1 simulations5.9960e+02s.
