Running Jacobi for 50 100 50 with OMP_NUM_THREADS=8
Output directed to: test (via scratch_jac_7003079/out)
Running GLOBAL topo-opt on cuboid: 50x100x50, V0=0.12, iters=50
Preconditioner: Jacobi

==========================Displaying Inputs==========================
Simulation: 0
..............................................Volume Fraction: 0.1200
..........................................Filter Radius: 1.7321 Cells
................................................Cell Size: 1.0000e+00
.................................................#CG Iterations:  800
...........................................Youngs Modulus: 1.0000e+00
....................................Youngs Modulus (Min.): 1.0000e-06
...........................................Poissons Ratio: 3.0000e-01
Multigrid disabled. Using Jacobi preconditioner.
Preparing Voxel-based FEA Model Costs        0.1s
Compliance of Fully Solid Domain:     6.370479e-01
 It.:    0 Solver Time:    6s.

 It.:   1 Obj.:  3.68449153e+02 Vol.:1.2000e-01 Sharp.:4.0574e-01 Cons.:-5.22e-08 Ch.:2.00e-01
 It.:    1 (Time)... Total per-It.: 6.38e+00s; CG: 6.35e+00s; Opti.: 3.37e-02s; Filtering: 2.60e-02s.
 It.:   2 Obj.:  2.19049456e+02 Vol.:1.2000e-01 Sharp.:4.0322e-01 Cons.:-1.49e-08 Ch.:2.00e-01
 It.:    2 (Time)... Total per-It.: 1.08e+01s; CG: 1.07e+01s; Opti.: 2.98e-02s; Filtering: 2.21e-02s.
 It.:   3 Obj.:  1.45720219e+02 Vol.:1.2000e-01 Sharp.:3.9016e-01 Cons.:-2.98e-08 Ch.:2.00e-01
 It.:    3 (Time)... Total per-It.: 1.10e+01s; CG: 1.10e+01s; Opti.: 3.00e-02s; Filtering: 2.22e-02s.
 It.:   4 Obj.:  1.17884779e+02 Vol.:1.2000e-01 Sharp.:3.8453e-01 Cons.:9.69e-08 Ch.:2.00e-01
 It.:    4 (Time)... Total per-It.: 1.07e+01s; CG: 1.07e+01s; Opti.: 2.85e-02s; Filtering: 2.09e-02s.
 It.:   5 Obj.:  9.62029851e+01 Vol.:1.2000e-01 Sharp.:3.7005e-01 Cons.:-7.45e-09 Ch.:2.00e-01
 It.:    5 (Time)... Total per-It.: 1.09e+01s; CG: 1.09e+01s; Opti.: 2.80e-02s; Filtering: 2.07e-02s.
 It.:   6 Obj.:  7.73901513e+01 Vol.:1.2000e-01 Sharp.:3.6126e-01 Cons.:5.22e-08 Ch.:2.00e-01
 It.:    6 (Time)... Total per-It.: 1.16e+01s; CG: 1.15e+01s; Opti.: 3.60e-02s; Filtering: 2.76e-02s.
 It.:   7 Obj.:  6.00302200e+01 Vol.:1.2000e-01 Sharp.:3.4256e-01 Cons.:-7.45e-09 Ch.:2.00e-01
 It.:    7 (Time)... Total per-It.: 1.11e+01s; CG: 1.11e+01s; Opti.: 2.56e-02s; Filtering: 1.79e-02s.
 It.:   8 Obj.:  4.40969173e+01 Vol.:1.2000e-01 Sharp.:3.1644e-01 Cons.:-7.45e-09 Ch.:2.00e-01
 It.:    8 (Time)... Total per-It.: 1.10e+01s; CG: 1.09e+01s; Opti.: 2.65e-02s; Filtering: 1.85e-02s.
 It.:   9 Obj.:  3.13487795e+01 Vol.:1.2000e-01 Sharp.:2.7814e-01 Cons.:-5.96e-08 Ch.:2.00e-01
 It.:    9 (Time)... Total per-It.: 1.10e+01s; CG: 1.09e+01s; Opti.: 2.52e-02s; Filtering: 1.81e-02s.
 It.:  10 Obj.:  1.86435130e+01 Vol.:1.2000e-01 Sharp.:2.3493e-01 Cons.:5.22e-08 Ch.:2.00e-01
 It.:   10 (Time)... Total per-It.: 1.10e+01s; CG: 1.10e+01s; Opti.: 2.42e-02s; Filtering: 1.70e-02s.
 It.:  11 Obj.:  1.31915848e+01 Vol.:1.2000e-01 Sharp.:1.9145e-01 Cons.:1.49e-08 Ch.:2.00e-01
 It.:   11 (Time)... Total per-It.: 1.11e+01s; CG: 1.11e+01s; Opti.: 2.61e-02s; Filtering: 1.78e-02s.
 It.:  12 Obj.:  9.74859647e+00 Vol.:1.2000e-01 Sharp.:1.6064e-01 Cons.:0.00e+00 Ch.:2.00e-01
 It.:   12 (Time)... Total per-It.: 1.11e+01s; CG: 1.11e+01s; Opti.: 2.45e-02s; Filtering: 1.62e-02s.
 It.:  13 Obj.:  8.04766467e+00 Vol.:1.2000e-01 Sharp.:1.3546e-01 Cons.:1.49e-08 Ch.:2.00e-01
 It.:   13 (Time)... Total per-It.: 1.11e+01s; CG: 1.11e+01s; Opti.: 2.48e-02s; Filtering: 1.64e-02s.
 It.:  14 Obj.:  7.20065635e+00 Vol.:1.2000e-01 Sharp.:1.1969e-01 Cons.:3.73e-08 Ch.:2.00e-01
 It.:   14 (Time)... Total per-It.: 1.11e+01s; CG: 1.10e+01s; Opti.: 2.44e-02s; Filtering: 1.64e-02s.
 It.:  15 Obj.:  6.57277190e+00 Vol.:1.2000e-01 Sharp.:1.0881e-01 Cons.:1.49e-08 Ch.:2.00e-01
 It.:   15 (Time)... Total per-It.: 1.11e+01s; CG: 1.11e+01s; Opti.: 2.36e-02s; Filtering: 1.57e-02s.
 It.:  16 Obj.:  6.30178899e+00 Vol.:1.2000e-01 Sharp.:1.0193e-01 Cons.:1.49e-08 Ch.:2.00e-01
 It.:   16 (Time)... Total per-It.: 1.11e+01s; CG: 1.11e+01s; Opti.: 1.96e-02s; Filtering: 1.20e-02s.
 It.:  17 Obj.:  6.08266635e+00 Vol.:1.2000e-01 Sharp.:9.7235e-02 Cons.:-7.45e-09 Ch.:2.00e-01
 It.:   17 (Time)... Total per-It.: 1.11e+01s; CG: 1.11e+01s; Opti.: 2.27e-02s; Filtering: 1.45e-02s.
 It.:  18 Obj.:  5.94990797e+00 Vol.:1.2000e-01 Sharp.:9.4071e-02 Cons.:1.49e-08 Ch.:2.00e-01
 It.:   18 (Time)... Total per-It.: 1.11e+01s; CG: 1.11e+01s; Opti.: 2.16e-02s; Filtering: 1.34e-02s.
 It.:  19 Obj.:  5.85359759e+00 Vol.:1.2000e-01 Sharp.:9.1731e-02 Cons.:1.49e-08 Ch.:2.00e-01
 It.:   19 (Time)... Total per-It.: 1.09e+01s; CG: 1.09e+01s; Opti.: 2.02e-02s; Filtering: 1.34e-02s.
 It.:  20 Obj.:  5.78579390e+00 Vol.:1.2000e-01 Sharp.:9.0843e-02 Cons.:-1.49e-08 Ch.:2.00e-01
 It.:   20 (Time)... Total per-It.: 1.11e+01s; CG: 1.10e+01s; Opti.: 1.62e-02s; Filtering: 8.53e-03s.
 It.:  21 Obj.:  5.75629330e+00 Vol.:1.2000e-01 Sharp.:8.9532e-02 Cons.:-2.24e-08 Ch.:2.00e-01
 It.:   21 (Time)... Total per-It.: 1.10e+01s; CG: 1.10e+01s; Opti.: 1.99e-02s; Filtering: 1.29e-02s.
 It.:  22 Obj.:  5.70259821e+00 Vol.:1.2000e-01 Sharp.:8.9260e-02 Cons.:7.45e-09 Ch.:1.62e-01
 It.:   22 (Time)... Total per-It.: 1.10e+01s; CG: 1.10e+01s; Opti.: 1.29e-02s; Filtering: 6.26e-03s.
 It.:  23 Obj.:  5.70228868e+00 Vol.:1.2000e-01 Sharp.:8.9426e-02 Cons.:0.00e+00 Ch.:1.90e-01
 It.:   23 (Time)... Total per-It.: 1.08e+01s; CG: 1.08e+01s; Opti.: 1.87e-02s; Filtering: 1.18e-02s.
 It.:  24 Obj.:  5.67460278e+00 Vol.:1.2000e-01 Sharp.:8.9511e-02 Cons.:1.49e-08 Ch.:1.13e-01
 It.:   24 (Time)... Total per-It.: 1.09e+01s; CG: 1.09e+01s; Opti.: 1.37e-02s; Filtering: 6.58e-03s.
 It.:  25 Obj.:  5.67270288e+00 Vol.:1.2000e-01 Sharp.:8.9480e-02 Cons.:0.00e+00 Ch.:2.00e-01
 It.:   25 (Time)... Total per-It.: 1.11e+01s; CG: 1.11e+01s; Opti.: 1.93e-02s; Filtering: 1.21e-02s.
 It.:  26 Obj.:  5.65144151e+00 Vol.:1.2000e-01 Sharp.:8.9388e-02 Cons.:3.73e-08 Ch.:2.00e-01
 It.:   26 (Time)... Total per-It.: 1.10e+01s; CG: 1.10e+01s; Opti.: 1.27e-02s; Filtering: 5.91e-03s.
 It.:  27 Obj.:  5.67726555e+00 Vol.:1.2000e-01 Sharp.:8.9833e-02 Cons.:-1.49e-08 Ch.:2.00e-01
 It.:   27 (Time)... Total per-It.: 1.10e+01s; CG: 1.10e+01s; Opti.: 1.88e-02s; Filtering: 1.18e-02s.
 It.:  28 Obj.:  5.62512924e+00 Vol.:1.2000e-01 Sharp.:8.9813e-02 Cons.:-1.49e-08 Ch.:2.00e-01
 It.:   28 (Time)... Total per-It.: 1.11e+01s; CG: 1.11e+01s; Opti.: 1.88e-02s; Filtering: 1.19e-02s.
 It.:  29 Obj.:  5.62815557e+00 Vol.:1.2000e-01 Sharp.:8.9737e-02 Cons.:1.49e-08 Ch.:9.47e-02
 It.:   29 (Time)... Total per-It.: 1.09e+01s; CG: 1.09e+01s; Opti.: 1.35e-02s; Filtering: 6.49e-03s.
 It.:  30 Obj.:  5.62865473e+00 Vol.:1.2000e-01 Sharp.:8.9977e-02 Cons.:-7.45e-09 Ch.:2.00e-01
 It.:   30 (Time)... Total per-It.: 1.12e+01s; CG: 1.12e+01s; Opti.: 1.88e-02s; Filtering: 1.16e-02s.
 It.:  31 Obj.:  5.59417237e+00 Vol.:1.2000e-01 Sharp.:8.9936e-02 Cons.:1.49e-08 Ch.:2.00e-01
 It.:   31 (Time)... Total per-It.: 1.10e+01s; CG: 1.10e+01s; Opti.: 1.69e-02s; Filtering: 9.30e-03s.
 It.:  32 Obj.:  5.61363356e+00 Vol.:1.2000e-01 Sharp.:8.9773e-02 Cons.:7.45e-09 Ch.:2.00e-01
 It.:   32 (Time)... Total per-It.: 1.10e+01s; CG: 1.10e+01s; Opti.: 1.88e-02s; Filtering: 1.18e-02s.
 It.:  33 Obj.:  5.56486812e+00 Vol.:1.2000e-01 Sharp.:8.9530e-02 Cons.:0.00e+00 Ch.:2.00e-01
 It.:   33 (Time)... Total per-It.: 1.11e+01s; CG: 1.11e+01s; Opti.: 1.41e-02s; Filtering: 6.95e-03s.
 It.:  34 Obj.:  5.59821177e+00 Vol.:1.2000e-01 Sharp.:8.9804e-02 Cons.:3.73e-08 Ch.:2.00e-01
 It.:   34 (Time)... Total per-It.: 1.11e+01s; CG: 1.11e+01s; Opti.: 1.89e-02s; Filtering: 1.19e-02s.
 It.:  35 Obj.:  5.54173678e+00 Vol.:1.2000e-01 Sharp.:8.9772e-02 Cons.:1.49e-08 Ch.:2.00e-01
 It.:   35 (Time)... Total per-It.: 1.12e+01s; CG: 1.12e+01s; Opti.: 1.42e-02s; Filtering: 7.25e-03s.
 It.:  36 Obj.:  5.56714272e+00 Vol.:1.2000e-01 Sharp.:8.9548e-02 Cons.:-1.49e-08 Ch.:2.00e-01
 It.:   36 (Time)... Total per-It.: 1.11e+01s; CG: 1.11e+01s; Opti.: 1.86e-02s; Filtering: 1.13e-02s.
 It.:  37 Obj.:  5.53835329e+00 Vol.:1.2000e-01 Sharp.:8.9318e-02 Cons.:-1.49e-08 Ch.:2.00e-01
 It.:   37 (Time)... Total per-It.: 1.11e+01s; CG: 1.11e+01s; Opti.: 1.38e-02s; Filtering: 6.86e-03s.
 It.:  38 Obj.:  5.54954807e+00 Vol.:1.2000e-01 Sharp.:8.9642e-02 Cons.:-2.24e-08 Ch.:2.00e-01
 It.:   38 (Time)... Total per-It.: 1.13e+01s; CG: 1.13e+01s; Opti.: 1.91e-02s; Filtering: 1.22e-02s.
 It.:  39 Obj.:  5.51597530e+00 Vol.:1.2000e-01 Sharp.:8.9645e-02 Cons.:3.73e-08 Ch.:2.00e-01
 It.:   39 (Time)... Total per-It.: 1.12e+01s; CG: 1.12e+01s; Opti.: 1.35e-02s; Filtering: 6.50e-03s.
 It.:  40 Obj.:  5.52835864e+00 Vol.:1.2000e-01 Sharp.:8.9162e-02 Cons.:-1.49e-08 Ch.:2.00e-01
 It.:   40 (Time)... Total per-It.: 1.11e+01s; CG: 1.11e+01s; Opti.: 1.90e-02s; Filtering: 1.20e-02s.
 It.:  41 Obj.:  5.49633325e+00 Vol.:1.2000e-01 Sharp.:8.8852e-02 Cons.:2.24e-08 Ch.:2.00e-01
 It.:   41 (Time)... Total per-It.: 1.13e+01s; CG: 1.12e+01s; Opti.: 1.36e-02s; Filtering: 6.66e-03s.
 It.:  42 Obj.:  5.50365272e+00 Vol.:1.2000e-01 Sharp.:8.9052e-02 Cons.:2.24e-08 Ch.:2.00e-01
 It.:   42 (Time)... Total per-It.: 1.12e+01s; CG: 1.12e+01s; Opti.: 1.89e-02s; Filtering: 1.17e-02s.
 It.:  43 Obj.:  5.47222261e+00 Vol.:1.2000e-01 Sharp.:8.9041e-02 Cons.:-1.49e-08 Ch.:2.00e-01
 It.:   43 (Time)... Total per-It.: 1.12e+01s; CG: 1.11e+01s; Opti.: 1.62e-02s; Filtering: 8.52e-03s.
 It.:  44 Obj.:  5.48731895e+00 Vol.:1.2000e-01 Sharp.:8.8894e-02 Cons.:0.00e+00 Ch.:2.00e-01
 It.:   44 (Time)... Total per-It.: 1.12e+01s; CG: 1.11e+01s; Opti.: 1.87e-02s; Filtering: 1.15e-02s.
 It.:  45 Obj.:  5.45764617e+00 Vol.:1.2000e-01 Sharp.:8.8699e-02 Cons.:1.49e-08 Ch.:2.00e-01
 It.:   45 (Time)... Total per-It.: 1.16e+01s; CG: 1.16e+01s; Opti.: 1.37e-02s; Filtering: 6.61e-03s.
 It.:  46 Obj.:  5.47565150e+00 Vol.:1.2000e-01 Sharp.:8.9391e-02 Cons.:-1.49e-08 Ch.:2.00e-01
 It.:   46 (Time)... Total per-It.: 1.16e+01s; CG: 1.16e+01s; Opti.: 1.97e-02s; Filtering: 1.24e-02s.
 It.:  47 Obj.:  5.46098242e+00 Vol.:1.2000e-01 Sharp.:8.9318e-02 Cons.:-1.49e-08 Ch.:2.00e-01
 It.:   47 (Time)... Total per-It.: 1.16e+01s; CG: 1.16e+01s; Opti.: 2.14e-02s; Filtering: 1.39e-02s.
 It.:  48 Obj.:  5.44554580e+00 Vol.:1.2000e-01 Sharp.:8.9251e-02 Cons.:-2.98e-08 Ch.:8.05e-02
 It.:   48 (Time)... Total per-It.: 1.16e+01s; CG: 1.16e+01s; Opti.: 1.42e-02s; Filtering: 6.76e-03s.
 It.:  49 Obj.:  5.44594213e+00 Vol.:1.2000e-01 Sharp.:8.9210e-02 Cons.:3.73e-08 Ch.:3.61e-02
 It.:   49 (Time)... Total per-It.: 1.09e+01s; CG: 1.09e+01s; Opti.: 1.38e-02s; Filtering: 6.88e-03s.
 It.:  50 Obj.:  5.44822152e+00 Vol.:1.2000e-01 Sharp.:8.9189e-02 Cons.:2.24e-08 Ch.:1.76e-02
 It.:   50 (Time)... Total per-It.: 5.38e+00s; CG: 5.36e+00s; Opti.: 1.39e-02s; Filtering: 7.02e-03s.

..........Performing Topology Optimization Costs (in total): 5.5151e+02s.

PARAMETERS
original dims: x=100, y=50, z=50
padded dims: x=104, y=56, z=56
v0: 0.12

SOLVING
iterations: 50
cg iterations: 800

RESULTS
compliance solid: 6.370479e-01
objective first: 3.684492e+02
objective last: 5.448222e+00

TIME
total solver time: 5.440270e+02
time per iter: 10.9015
percentage time spent on cg: 99.81%
percentage time spent on optim: 0.19%
percentage time spent on filtering: 0.12%

THREADS
8

NOTES

STL file saved to: /orcd/home/002/nhirt/AlgorithmEngineering_AltProject/scratch_jac_7003079/out/stl/GLOBAL_20251208_021044_7003079.stl

Done.

............Total runtime time for 1 simulations5.5153e+02s.
