Running Multigrid for 50 100 50 with OMP_NUM_THREADS=32
Output directed to: test_scaling (via scratch_mg_7017823/out)
Running GLOBAL topo-opt on cuboid: 50x100x50, V0=0.12, iters=50
Preconditioner: Multigrid

==========================Displaying Inputs==========================
Simulation: 0
..............................................Volume Fraction: 0.1200
..........................................Filter Radius: 1.7321 Cells
................................................Cell Size: 1.0000e+00
.................................................#CG Iterations:  800
...........................................Youngs Modulus: 1.0000e+00
....................................Youngs Modulus (Min.): 1.0000e-06
...........................................Poissons Ratio: 3.0000e-01
Building Multigrid Hierarchy...
[MG] levels=3 coarsest=13x7x7 dofs=2688
Preparing Voxel-based FEA Model Costs        0.1s
Compliance of Fully Solid Domain:     6.370327e-01
 It.:    0 Solver Time:    5s.

 It.:   1 Obj.:  3.68440325e+02 Vol.:1.2000e-01 Sharp.:4.0574e-01 Cons.:-2.98e-08 Ch.:2.00e-01
 It.:    1 (Time)... Total per-It.: 4.99e+00s; CG: 4.97e+00s; Opti.: 1.80e-02s; Filtering: 1.24e-02s.
 It.:   2 Obj.:  4.05475284e+02 Vol.:1.2000e-01 Sharp.:4.0069e-01 Cons.:-4.47e-08 Ch.:2.00e-01
 It.:    2 (Time)... Total per-It.: 5.99e+00s; CG: 5.97e+00s; Opti.: 1.61e-02s; Filtering: 1.06e-02s.
 It.:   3 Obj.:  1.75821843e+02 Vol.:1.2000e-01 Sharp.:3.9187e-01 Cons.:-2.98e-08 Ch.:2.00e-01
 It.:    3 (Time)... Total per-It.: 6.08e+00s; CG: 6.06e+00s; Opti.: 1.61e-02s; Filtering: 1.04e-02s.
 It.:   4 Obj.:  3.00413204e+02 Vol.:1.2000e-01 Sharp.:3.8680e-01 Cons.:-1.49e-08 Ch.:2.00e-01
 It.:    4 (Time)... Total per-It.: 5.62e+00s; CG: 5.60e+00s; Opti.: 1.39e-02s; Filtering: 8.69e-03s.
 It.:   5 Obj.:  1.58669124e+02 Vol.:1.2000e-01 Sharp.:3.7361e-01 Cons.:7.45e-08 Ch.:2.00e-01
 It.:    5 (Time)... Total per-It.: 5.32e+00s; CG: 5.30e+00s; Opti.: 1.69e-02s; Filtering: 1.12e-02s.
 It.:   6 Obj.:  7.45481218e+01 Vol.:1.2000e-01 Sharp.:3.6023e-01 Cons.:-4.47e-08 Ch.:2.00e-01
 It.:    6 (Time)... Total per-It.: 5.87e+00s; CG: 5.86e+00s; Opti.: 1.29e-02s; Filtering: 7.72e-03s.
 It.:   7 Obj.:  6.73489202e+01 Vol.:1.2000e-01 Sharp.:3.2894e-01 Cons.:3.73e-08 Ch.:2.00e-01
 It.:    7 (Time)... Total per-It.: 6.38e+00s; CG: 6.36e+00s; Opti.: 1.36e-02s; Filtering: 8.23e-03s.
 It.:   8 Obj.:  5.43976183e+01 Vol.:1.2000e-01 Sharp.:3.0254e-01 Cons.:7.45e-09 Ch.:2.00e-01
 It.:    8 (Time)... Total per-It.: 6.38e+00s; CG: 6.36e+00s; Opti.: 1.55e-02s; Filtering: 1.00e-02s.
 It.:   9 Obj.:  4.21027959e+01 Vol.:1.2000e-01 Sharp.:2.6331e-01 Cons.:7.45e-09 Ch.:2.00e-01
 It.:    9 (Time)... Total per-It.: 6.38e+00s; CG: 6.36e+00s; Opti.: 1.33e-02s; Filtering: 8.01e-03s.
 It.:  10 Obj.:  2.60899823e+01 Vol.:1.2000e-01 Sharp.:2.1760e-01 Cons.:4.47e-08 Ch.:2.00e-01
 It.:   10 (Time)... Total per-It.: 5.32e+00s; CG: 5.30e+00s; Opti.: 1.27e-02s; Filtering: 7.39e-03s.
 It.:  11 Obj.:  3.81876958e+01 Vol.:1.2000e-01 Sharp.:1.8952e-01 Cons.:5.22e-08 Ch.:2.00e-01
 It.:   11 (Time)... Total per-It.: 5.53e+00s; CG: 5.51e+00s; Opti.: 1.49e-02s; Filtering: 9.30e-03s.
 It.:  12 Obj.:  4.86241191e+01 Vol.:1.2000e-01 Sharp.:1.6123e-01 Cons.:-1.49e-08 Ch.:2.00e-01
 It.:   12 (Time)... Total per-It.: 6.16e+00s; CG: 6.14e+00s; Opti.: 1.28e-02s; Filtering: 7.54e-03s.
 It.:  13 Obj.:  5.52523977e+01 Vol.:1.2000e-01 Sharp.:1.3907e-01 Cons.:4.47e-08 Ch.:2.00e-01
 It.:   13 (Time)... Total per-It.: 6.16e+00s; CG: 6.15e+00s; Opti.: 1.38e-02s; Filtering: 8.47e-03s.
 It.:  14 Obj.:  6.27881610e+01 Vol.:1.2000e-01 Sharp.:1.2299e-01 Cons.:3.73e-08 Ch.:2.00e-01
 It.:   14 (Time)... Total per-It.: 6.16e+00s; CG: 6.15e+00s; Opti.: 1.30e-02s; Filtering: 7.61e-03s.
 It.:  15 Obj.:  4.97360946e+01 Vol.:1.2000e-01 Sharp.:1.1491e-01 Cons.:3.73e-08 Ch.:2.00e-01
 It.:   15 (Time)... Total per-It.: 5.31e+00s; CG: 5.29e+00s; Opti.: 1.37e-02s; Filtering: 8.36e-03s.
 It.:  16 Obj.:  2.08341781e+01 Vol.:1.2000e-01 Sharp.:1.2081e-01 Cons.:-2.98e-08 Ch.:2.00e-01
 It.:   16 (Time)... Total per-It.: 5.45e+00s; CG: 5.43e+00s; Opti.: 1.65e-02s; Filtering: 1.07e-02s.
 It.:  17 Obj.:  2.03137119e+01 Vol.:1.2000e-01 Sharp.:1.1635e-01 Cons.:3.73e-08 Ch.:2.00e-01
 It.:   17 (Time)... Total per-It.: 5.53e+00s; CG: 5.51e+00s; Opti.: 1.34e-02s; Filtering: 7.98e-03s.
 It.:  18 Obj.:  2.34604922e+01 Vol.:1.2000e-01 Sharp.:1.1042e-01 Cons.:1.49e-08 Ch.:2.00e-01
 It.:   18 (Time)... Total per-It.: 5.55e+00s; CG: 5.53e+00s; Opti.: 1.31e-02s; Filtering: 7.82e-03s.
 It.:  19 Obj.:  2.72319882e+01 Vol.:1.2000e-01 Sharp.:1.0345e-01 Cons.:-1.49e-08 Ch.:2.00e-01
 It.:   19 (Time)... Total per-It.: 5.55e+00s; CG: 5.53e+00s; Opti.: 1.35e-02s; Filtering: 7.99e-03s.
 It.:  20 Obj.:  1.63692399e+01 Vol.:1.2000e-01 Sharp.:1.1166e-01 Cons.:2.24e-08 Ch.:2.00e-01
 It.:   20 (Time)... Total per-It.: 5.32e+00s; CG: 5.30e+00s; Opti.: 1.29e-02s; Filtering: 7.48e-03s.
 It.:  21 Obj.:  1.19765790e+01 Vol.:1.2000e-01 Sharp.:1.0998e-01 Cons.:3.73e-08 Ch.:2.00e-01
 It.:   21 (Time)... Total per-It.: 5.32e+00s; CG: 5.30e+00s; Opti.: 1.55e-02s; Filtering: 9.72e-03s.
 It.:  22 Obj.:  1.38684434e+01 Vol.:1.2000e-01 Sharp.:1.0720e-01 Cons.:2.24e-08 Ch.:2.00e-01
 It.:   22 (Time)... Total per-It.: 5.31e+00s; CG: 5.30e+00s; Opti.: 1.25e-02s; Filtering: 7.14e-03s.
 It.:  23 Obj.:  1.59432963e+01 Vol.:1.2000e-01 Sharp.:1.0272e-01 Cons.:7.45e-09 Ch.:2.00e-01
 It.:   23 (Time)... Total per-It.: 5.78e+00s; CG: 5.76e+00s; Opti.: 1.29e-02s; Filtering: 7.40e-03s.
 It.:  24 Obj.:  1.83203617e+01 Vol.:1.2000e-01 Sharp.:9.8102e-02 Cons.:-1.49e-08 Ch.:2.00e-01
 It.:   24 (Time)... Total per-It.: 6.17e+00s; CG: 6.15e+00s; Opti.: 1.26e-02s; Filtering: 7.22e-03s.
 It.:  25 Obj.:  9.01489999e+00 Vol.:1.2000e-01 Sharp.:9.7616e-02 Cons.:1.49e-08 Ch.:2.00e-01
 It.:   25 (Time)... Total per-It.: 5.30e+00s; CG: 5.29e+00s; Opti.: 1.32e-02s; Filtering: 7.60e-03s.
 It.:  26 Obj.:  8.00478863e+00 Vol.:1.2000e-01 Sharp.:9.4495e-02 Cons.:0.00e+00 Ch.:2.00e-01
 It.:   26 (Time)... Total per-It.: 5.29e+00s; CG: 5.27e+00s; Opti.: 1.24e-02s; Filtering: 7.05e-03s.
 It.:  27 Obj.:  8.19892444e+00 Vol.:1.2000e-01 Sharp.:9.2123e-02 Cons.:-2.98e-08 Ch.:2.00e-01
 It.:   27 (Time)... Total per-It.: 5.29e+00s; CG: 5.27e+00s; Opti.: 1.25e-02s; Filtering: 7.11e-03s.
 It.:  28 Obj.:  8.22036067e+00 Vol.:1.2000e-01 Sharp.:9.0601e-02 Cons.:-1.49e-08 Ch.:2.00e-01
 It.:   28 (Time)... Total per-It.: 6.06e+00s; CG: 6.04e+00s; Opti.: 1.48e-02s; Filtering: 9.12e-03s.
 It.:  29 Obj.:  8.47428027e+00 Vol.:1.2000e-01 Sharp.:9.0097e-02 Cons.:-3.73e-08 Ch.:2.00e-01
 It.:   29 (Time)... Total per-It.: 6.15e+00s; CG: 6.13e+00s; Opti.: 1.21e-02s; Filtering: 6.70e-03s.
 It.:  30 Obj.:  8.35486215e+00 Vol.:1.2000e-01 Sharp.:8.9846e-02 Cons.:-3.73e-08 Ch.:2.00e-01
 It.:   30 (Time)... Total per-It.: 5.34e+00s; CG: 5.32e+00s; Opti.: 1.29e-02s; Filtering: 7.32e-03s.
 It.:  31 Obj.:  6.85173542e+00 Vol.:1.2000e-01 Sharp.:8.9828e-02 Cons.:7.45e-09 Ch.:2.00e-01
 It.:   31 (Time)... Total per-It.: 5.34e+00s; CG: 5.32e+00s; Opti.: 1.30e-02s; Filtering: 7.54e-03s.
 It.:  32 Obj.:  6.92101056e+00 Vol.:1.2000e-01 Sharp.:8.8866e-02 Cons.:-1.49e-08 Ch.:2.00e-01
 It.:   32 (Time)... Total per-It.: 5.35e+00s; CG: 5.33e+00s; Opti.: 1.18e-02s; Filtering: 6.26e-03s.
 It.:  33 Obj.:  6.93861984e+00 Vol.:1.2000e-01 Sharp.:8.8213e-02 Cons.:-2.24e-08 Ch.:2.00e-01
 It.:   33 (Time)... Total per-It.: 5.34e+00s; CG: 5.33e+00s; Opti.: 1.25e-02s; Filtering: 7.00e-03s.
 It.:  34 Obj.:  6.94624328e+00 Vol.:1.2000e-01 Sharp.:8.7162e-02 Cons.:-7.45e-09 Ch.:2.00e-01
 It.:   34 (Time)... Total per-It.: 5.34e+00s; CG: 5.33e+00s; Opti.: 1.26e-02s; Filtering: 7.09e-03s.
 It.:  35 Obj.:  5.51863784e+00 Vol.:1.2000e-01 Sharp.:8.7639e-02 Cons.:-7.45e-09 Ch.:2.00e-01
 It.:   35 (Time)... Total per-It.: 5.96e+00s; CG: 5.95e+00s; Opti.: 1.46e-02s; Filtering: 8.67e-03s.
 It.:  36 Obj.:  5.74150729e+00 Vol.:1.2000e-01 Sharp.:8.6773e-02 Cons.:-1.49e-08 Ch.:2.00e-01
 It.:   36 (Time)... Total per-It.: 6.17e+00s; CG: 6.15e+00s; Opti.: 1.17e-02s; Filtering: 6.33e-03s.
 It.:  37 Obj.:  5.57100685e+00 Vol.:1.2000e-01 Sharp.:8.6341e-02 Cons.:2.24e-08 Ch.:2.00e-01
 It.:   37 (Time)... Total per-It.: 6.17e+00s; CG: 6.15e+00s; Opti.: 1.18e-02s; Filtering: 6.33e-03s.
 It.:  38 Obj.:  5.65498220e+00 Vol.:1.2000e-01 Sharp.:8.5835e-02 Cons.:-1.49e-08 Ch.:2.00e-01
 It.:   38 (Time)... Total per-It.: 6.17e+00s; CG: 6.15e+00s; Opti.: 1.12e-02s; Filtering: 5.85e-03s.
 It.:  39 Obj.:  5.63046737e+00 Vol.:1.2000e-01 Sharp.:8.5600e-02 Cons.:-7.45e-09 Ch.:1.92e-01
 It.:   39 (Time)... Total per-It.: 6.17e+00s; CG: 6.16e+00s; Opti.: 1.07e-02s; Filtering: 5.17e-03s.
 It.:  40 Obj.:  5.52112974e+00 Vol.:1.2000e-01 Sharp.:8.5872e-02 Cons.:-1.49e-08 Ch.:2.00e-01
 It.:   40 (Time)... Total per-It.: 5.31e+00s; CG: 5.29e+00s; Opti.: 1.21e-02s; Filtering: 6.72e-03s.
 It.:  41 Obj.:  5.61380917e+00 Vol.:1.2000e-01 Sharp.:8.5730e-02 Cons.:1.49e-08 Ch.:2.00e-01
 It.:   41 (Time)... Total per-It.: 5.29e+00s; CG: 5.27e+00s; Opti.: 1.18e-02s; Filtering: 6.30e-03s.
 It.:  42 Obj.:  5.59715645e+00 Vol.:1.2000e-01 Sharp.:8.5626e-02 Cons.:1.49e-08 Ch.:2.00e-01
 It.:   42 (Time)... Total per-It.: 5.29e+00s; CG: 5.28e+00s; Opti.: 9.85e-03s; Filtering: 4.40e-03s.
 It.:  43 Obj.:  5.59851308e+00 Vol.:1.2000e-01 Sharp.:8.5891e-02 Cons.:0.00e+00 Ch.:2.00e-01
 It.:   43 (Time)... Total per-It.: 5.29e+00s; CG: 5.28e+00s; Opti.: 1.19e-02s; Filtering: 6.46e-03s.
 It.:  44 Obj.:  5.58805583e+00 Vol.:1.2000e-01 Sharp.:8.5913e-02 Cons.:3.73e-08 Ch.:2.00e-01
 It.:   44 (Time)... Total per-It.: 5.42e+00s; CG: 5.40e+00s; Opti.: 1.34e-02s; Filtering: 7.44e-03s.
 It.:  45 Obj.:  5.53866563e+00 Vol.:1.2000e-01 Sharp.:8.6134e-02 Cons.:3.73e-08 Ch.:2.00e-01
 It.:   45 (Time)... Total per-It.: 5.31e+00s; CG: 5.30e+00s; Opti.: 1.25e-02s; Filtering: 6.96e-03s.
 It.:  46 Obj.:  5.55700533e+00 Vol.:1.2000e-01 Sharp.:8.6145e-02 Cons.:-1.49e-08 Ch.:2.00e-01
 It.:   46 (Time)... Total per-It.: 5.29e+00s; CG: 5.28e+00s; Opti.: 9.88e-03s; Filtering: 4.48e-03s.
 It.:  47 Obj.:  5.54857384e+00 Vol.:1.2000e-01 Sharp.:8.6528e-02 Cons.:-2.98e-08 Ch.:2.00e-01
 It.:   47 (Time)... Total per-It.: 5.30e+00s; CG: 5.28e+00s; Opti.: 1.12e-02s; Filtering: 5.73e-03s.
 It.:  48 Obj.:  5.50222994e+00 Vol.:1.2000e-01 Sharp.:8.6642e-02 Cons.:1.49e-08 Ch.:1.59e-01
 It.:   48 (Time)... Total per-It.: 5.30e+00s; CG: 5.28e+00s; Opti.: 1.16e-02s; Filtering: 6.15e-03s.
 It.:  49 Obj.:  5.53073567e+00 Vol.:1.2000e-01 Sharp.:8.6654e-02 Cons.:7.45e-09 Ch.:6.92e-02
 It.:   49 (Time)... Total per-It.: 5.30e+00s; CG: 5.28e+00s; Opti.: 1.02e-02s; Filtering: 4.71e-03s.
 It.:  50 Obj.:  5.49029837e+00 Vol.:1.2000e-01 Sharp.:8.6857e-02 Cons.:-1.49e-08 Ch.:2.00e-01
 It.:   50 (Time)... Total per-It.: 5.30e+00s; CG: 5.29e+00s; Opti.: 1.14e-02s; Filtering: 5.96e-03s.

..........Performing Topology Optimization Costs (in total): 2.8687e+02s.

PARAMETERS
original dims: x=100, y=50, z=50
padded dims: x=104, y=56, z=56
v0: 0.12

SOLVING
iterations: 50
cg iterations: 800

RESULTS
compliance solid: 6.370327e-01
objective first: 3.684403e+02
objective last: 5.490298e+00

TIME
total solver time: 2.806328e+02
time per iter: 5.6291
percentage time spent on cg: 99.71%
percentage time spent on optim: 0.23%
percentage time spent on filtering: 0.13%

THREADS
32

NOTES

STL file saved to: ./out/stl/GLOBAL_20251208_105747_7017823.stl

Done.

............Total runtime time for 1 simulations2.8688e+02s.